-- phpMyAdmin SQL Dump
-- version 5.2.1
-- https://www.phpmyadmin.net/
--
-- Host: localhost
-- Generation Time: Feb 04, 2026 at 11:12 PM
-- Server version: 8.0.44-0ubuntu0.24.04.2
-- PHP Version: 8.2.12

SET SQL_MODE = "NO_AUTO_VALUE_ON_ZERO";
START TRANSACTION;
SET time_zone = "+00:00";


/*!40101 SET @OLD_CHARACTER_SET_CLIENT=@@CHARACTER_SET_CLIENT */;
/*!40101 SET @OLD_CHARACTER_SET_RESULTS=@@CHARACTER_SET_RESULTS */;
/*!40101 SET @OLD_COLLATION_CONNECTION=@@COLLATION_CONNECTION */;
/*!40101 SET NAMES utf8mb4 */;

--
-- Database: `wealth`
--

-- --------------------------------------------------------

--
-- Table structure for table `admins`
--

CREATE TABLE `admins` (
  `id` bigint UNSIGNED NOT NULL,
  `balance` double(20,2) NOT NULL DEFAULT '0.00',
  `name` varchar(255) CHARACTER SET utf8mb4 COLLATE utf8mb4_unicode_ci NOT NULL,
  `photo` varchar(255) CHARACTER SET utf8mb4 COLLATE utf8mb4_unicode_ci DEFAULT NULL,
  `email` varchar(255) CHARACTER SET utf8mb4 COLLATE utf8mb4_unicode_ci NOT NULL,
  `email_verified_at` timestamp NULL DEFAULT NULL,
  `password` varchar(255) CHARACTER SET utf8mb4 COLLATE utf8mb4_unicode_ci NOT NULL,
  `type` varchar(255) CHARACTER SET utf8mb4 COLLATE utf8mb4_unicode_ci NOT NULL,
  `phone` varchar(255) CHARACTER SET utf8mb4 COLLATE utf8mb4_unicode_ci DEFAULT NULL,
  `salary_date` varchar(255) CHARACTER SET utf8mb4 COLLATE utf8mb4_unicode_ci DEFAULT NULL,
  `address` varchar(255) CHARACTER SET utf8mb4 COLLATE utf8mb4_unicode_ci DEFAULT NULL,
  `remember_token` varchar(100) CHARACTER SET utf8mb4 COLLATE utf8mb4_unicode_ci DEFAULT NULL,
  `created_at` timestamp NULL DEFAULT NULL,
  `updated_at` timestamp NULL DEFAULT NULL
) ENGINE=InnoDB DEFAULT CHARSET=utf8mb4 COLLATE=utf8mb4_unicode_ci;

--
-- Dumping data for table `admins`
--

INSERT INTO `admins` (`id`, `balance`, `name`, `photo`, `email`, `email_verified_at`, `password`, `type`, `phone`, `salary_date`, `address`, `remember_token`, `created_at`, `updated_at`) VALUES
(5, 0.00, 'Admin', NULL, 'my@gmail.com', NULL, '$2y$10$OaniMGy3.qmFspYbXqVLDe51.WfsJvKV2XGzpifACKUTps1s41dK.', 'admin', NULL, NULL, NULL, NULL, '2026-01-21 03:51:11', '2026-01-21 03:53:33'),
(6, 0.00, 'Admin', NULL, 'mine\r\n@gmail.com', NULL, '$2y$10$OaniMGy3.qmFspYbXqVLDe51.WfsJvKV2XGzpifACKUTps1s41dK.', 'admin', NULL, NULL, NULL, NULL, '2026-01-21 03:51:11', '2026-01-21 03:53:33');

-- --------------------------------------------------------

--
-- Table structure for table `admin_ledgers`
--

CREATE TABLE `admin_ledgers` (
  `id` bigint UNSIGNED NOT NULL,
  `admin_id` bigint UNSIGNED NOT NULL,
  `reason` varchar(255) CHARACTER SET utf8mb4 COLLATE utf8mb4_unicode_ci NOT NULL,
  `perticulation` varchar(255) CHARACTER SET utf8mb4 COLLATE utf8mb4_unicode_ci DEFAULT NULL,
  `amount` double NOT NULL DEFAULT '0',
  `debit` double NOT NULL DEFAULT '0',
  `credit` double NOT NULL DEFAULT '0',
  `status` enum('pending','approved','rejected','default') CHARACTER SET utf8mb4 COLLATE utf8mb4_unicode_ci NOT NULL DEFAULT 'default',
  `date` varchar(255) CHARACTER SET utf8mb4 COLLATE utf8mb4_unicode_ci DEFAULT NULL,
  `created_at` timestamp NULL DEFAULT NULL,
  `updated_at` timestamp NULL DEFAULT NULL
) ENGINE=InnoDB DEFAULT CHARSET=utf8mb4 COLLATE=utf8mb4_unicode_ci;

--
-- Dumping data for table `admin_ledgers`
--

INSERT INTO `admin_ledgers` (`id`, `admin_id`, `reason`, `perticulation`, `amount`, `debit`, `credit`, `status`, `date`, `created_at`, `updated_at`) VALUES
(1, 1, 'payment_charge', 'Payment approval charge', 7000, 0, 0, 'approved', '23-12-2023 12:20', '2023-12-23 12:20:58', '2023-12-23 12:20:58'),
(2, 1, 'payment_charge', 'Withdraw approval charge', 200, 20, 0, 'approved', '31-12-2023 21:49', '2023-12-31 21:49:58', '2023-12-31 21:49:58'),
(3, 1, 'payment_charge', 'Withdraw approval charge', 1000, 100, 0, 'approved', '13-01-2024 02:10', '2024-01-13 02:10:38', '2024-01-13 02:10:38'),
(4, 1, 'payment_charge', 'Withdraw approval charge', 500, 50, 0, 'approved', '02-05-2024 23:13', '2024-05-02 22:13:59', '2024-05-02 22:13:59'),
(5, 1, 'payment_charge', 'Withdraw approval charge', 500, 50, 0, 'approved', '04-05-2024 14:12', '2024-05-04 14:12:26', '2024-05-04 14:12:26'),
(6, 1, 'payment_charge', 'Withdraw approval charge', 1000, 100, 0, 'approved', '04-05-2024 14:12', '2024-05-04 14:12:34', '2024-05-04 14:12:34'),
(7, 1, 'payment_charge', 'Withdraw approval charge', 300, 30, 0, 'approved', '04-05-2024 14:12', '2024-05-04 14:12:40', '2024-05-04 14:12:40'),
(8, 1, 'payment_charge', 'Withdraw approval charge', 200, 10, 0, 'approved', '04-05-2024 14:53', '2024-05-04 14:53:48', '2024-05-04 14:53:48'),
(9, 1, 'payment_charge', 'Withdraw approval charge', 205, 10.25, 0, 'approved', '04-05-2024 14:54', '2024-05-04 14:54:31', '2024-05-04 14:54:31'),
(10, 1, 'payment_charge', 'Withdraw approval charge', 205, 10.25, 0, 'approved', '04-05-2024 14:55', '2024-05-04 14:55:49', '2024-05-04 14:55:49'),
(11, 1, 'payment_charge', 'Withdraw approval charge', 200, 10, 0, 'approved', '04-05-2024 14:56', '2024-05-04 14:56:07', '2024-05-04 14:56:07'),
(12, 1, 'payment_charge', 'Withdraw approval charge', 200, 10, 0, 'approved', '04-05-2024 14:56', '2024-05-04 14:56:38', '2024-05-04 14:56:38'),
(13, 1, 'payment_charge', 'Withdraw approval charge', 200, 10, 0, 'approved', '04-05-2024 15:11', '2024-05-04 15:11:17', '2024-05-04 15:11:17'),
(14, 1, 'payment_charge', 'Withdraw approval charge', 200, 10, 0, 'approved', '04-05-2024 15:12', '2024-05-04 15:12:08', '2024-05-04 15:12:08'),
(15, 1, 'payment_charge', 'Withdraw approval charge', 440, 22, 0, 'approved', '04-05-2024 15:13', '2024-05-04 15:13:16', '2024-05-04 15:13:16'),
(16, 1, 'payment_charge', 'Withdraw approval charge', 205, 10.25, 0, 'approved', '04-05-2024 15:13', '2024-05-04 15:13:58', '2024-05-04 15:13:58'),
(17, 1, 'payment_charge', 'Withdraw approval charge', 200, 10, 0, 'approved', '04-05-2024 15:14', '2024-05-04 15:14:35', '2024-05-04 15:14:35'),
(18, 1, 'payment_charge', 'Withdraw approval charge', 200, 10, 0, 'approved', '04-05-2024 15:15', '2024-05-04 15:15:15', '2024-05-04 15:15:15'),
(19, 1, 'payment_charge', 'Withdraw approval charge', 205, 10.25, 0, 'approved', '04-05-2024 15:15', '2024-05-04 15:15:43', '2024-05-04 15:15:43'),
(20, 1, 'payment_charge', 'Withdraw approval charge', 205, 10.25, 0, 'approved', '04-05-2024 15:16', '2024-05-04 15:16:17', '2024-05-04 15:16:17'),
(21, 1, 'payment_charge', 'Withdraw approval charge', 200, 10, 0, 'approved', '04-05-2024 15:16', '2024-05-04 15:16:43', '2024-05-04 15:16:43'),
(22, 1, 'payment_charge', 'Withdraw approval charge', 200, 10, 0, 'approved', '04-05-2024 15:17', '2024-05-04 15:17:07', '2024-05-04 15:17:07'),
(23, 1, 'payment_charge', 'Withdraw approval charge', 200, 10, 0, 'approved', '04-05-2024 15:34', '2024-05-04 15:34:43', '2024-05-04 15:34:43'),
(24, 1, 'payment_charge', 'Withdraw approval charge', 200, 10, 0, 'approved', '04-05-2024 15:35', '2024-05-04 15:35:31', '2024-05-04 15:35:31'),
(25, 1, 'payment_charge', 'Withdraw approval charge', 200, 10, 0, 'approved', '04-05-2024 15:48', '2024-05-04 15:48:25', '2024-05-04 15:48:25'),
(26, 1, 'payment_charge', 'Withdraw approval charge', 205, 10.25, 0, 'approved', '04-05-2024 15:49', '2024-05-04 15:49:09', '2024-05-04 15:49:09'),
(27, 1, 'payment_charge', 'Withdraw approval charge', 200, 10, 0, 'approved', '04-05-2024 16:00', '2024-05-04 16:00:39', '2024-05-04 16:00:39'),
(28, 1, 'payment_charge', 'Withdraw approval charge', 200, 10, 0, 'approved', '04-05-2024 16:01', '2024-05-04 16:01:28', '2024-05-04 16:01:28'),
(29, 1, 'payment_charge', 'Withdraw approval charge', 200, 10, 0, 'approved', '04-05-2024 16:16', '2024-05-04 16:16:58', '2024-05-04 16:16:58'),
(30, 1, 'payment_charge', 'Withdraw approval charge', 200, 10, 0, 'approved', '04-05-2024 16:16', '2024-05-04 16:16:59', '2024-05-04 16:16:59'),
(31, 1, 'payment_charge', 'Withdraw approval charge', 205, 10.25, 0, 'approved', '04-05-2024 16:17', '2024-05-04 16:17:30', '2024-05-04 16:17:30'),
(32, 1, 'payment_charge', 'Withdraw approval charge', 205, 10.25, 0, 'approved', '04-05-2024 16:20', '2024-05-04 16:20:14', '2024-05-04 16:20:14'),
(33, 1, 'payment_charge', 'Withdraw approval charge', 209, 10.45, 0, 'approved', '04-05-2024 16:20', '2024-05-04 16:20:43', '2024-05-04 16:20:43'),
(34, 1, 'payment_charge', 'Withdraw approval charge', 200, 10, 0, 'approved', '04-05-2024 16:23', '2024-05-04 16:23:30', '2024-05-04 16:23:30'),
(35, 1, 'payment_charge', 'Withdraw approval charge', 205, 10.25, 0, 'approved', '04-05-2024 16:24', '2024-05-04 16:24:03', '2024-05-04 16:24:03'),
(36, 1, 'payment_charge', 'Withdraw approval charge', 217, 10.85, 0, 'approved', '04-05-2024 16:56', '2024-05-04 16:56:01', '2024-05-04 16:56:01'),
(37, 1, 'payment_charge', 'Withdraw approval charge', 249, 12.45, 0, 'approved', '04-05-2024 17:31', '2024-05-04 17:31:09', '2024-05-04 17:31:09'),
(38, 1, 'payment_charge', 'Withdraw approval charge', 200, 10, 0, 'approved', '04-05-2024 17:54', '2024-05-04 17:54:08', '2024-05-04 17:54:08'),
(39, 1, 'payment_charge', 'Withdraw approval charge', 221, 11.05, 0, 'approved', '04-05-2024 17:57', '2024-05-04 17:57:16', '2024-05-04 17:57:16'),
(40, 1, 'payment_charge', 'Withdraw approval charge', 246, 12.3, 0, 'approved', '04-05-2024 19:44', '2024-05-04 19:44:57', '2024-05-04 19:44:57'),
(41, 1, 'payment_charge', 'Withdraw approval charge', 200, 10, 0, 'approved', '04-05-2024 19:45', '2024-05-04 19:45:27', '2024-05-04 19:45:27'),
(42, 1, 'payment_charge', 'Withdraw approval charge', 246, 12.3, 0, 'approved', '05-05-2024 10:30', '2024-05-05 10:30:48', '2024-05-05 10:30:48'),
(43, 1, 'payment_charge', 'Withdraw approval charge', 354, 17.7, 0, 'approved', '05-05-2024 12:31', '2024-05-05 12:31:41', '2024-05-05 12:31:41'),
(44, 1, 'payment_charge', 'Withdraw approval charge', 201, 10.05, 0, 'approved', '05-05-2024 15:16', '2024-05-05 15:16:27', '2024-05-05 15:16:27'),
(45, 1, 'payment_charge', 'Withdraw approval charge', 35, 1.75, 0, 'approved', '12-05-2024 02:36', '2024-05-12 00:36:28', '2024-05-12 00:36:28'),
(46, 1, 'payment_charge', 'Withdraw approval charge', 85, 4.25, 0, 'approved', '28-06-2025 13:15', '2025-06-28 13:15:22', '2025-06-28 13:15:22'),
(47, 1, 'payment_charge', 'Withdraw approval charge', 200, 10, 0, 'approved', '28-06-2025 13:15', '2025-06-28 13:15:26', '2025-06-28 13:15:26'),
(48, 1, 'payment_charge', 'Withdraw approval charge', 200, 10, 0, 'approved', '28-06-2025 13:15', '2025-06-28 13:15:34', '2025-06-28 13:15:34'),
(49, 1, 'payment_charge', 'Withdraw approval charge', 2342, 351.3, 0, 'approved', '29-06-2025 10:04', '2025-06-29 10:04:12', '2025-06-29 10:04:12'),
(50, 1, 'payment_charge', 'Withdraw approval charge', 640, 96, 0, 'approved', '29-06-2025 10:04', '2025-06-29 10:04:16', '2025-06-29 10:04:16'),
(51, 1, 'payment_charge', 'Withdraw approval charge', 309, 46.35, 0, 'approved', '29-06-2025 10:04', '2025-06-29 10:04:20', '2025-06-29 10:04:20'),
(52, 1, 'payment_charge', 'Withdraw approval charge', 2100, 315, 0, 'approved', '29-06-2025 11:07', '2025-06-29 15:07:51', '2025-06-29 15:07:51'),
(53, 1, 'payment_charge', 'Withdraw approval charge', 740, 111, 0, 'approved', '29-06-2025 13:50', '2025-06-29 17:50:31', '2025-06-29 17:50:31'),
(54, 1, 'payment_charge', 'Withdraw approval charge', 3154, 473.1, 0, 'approved', '29-06-2025 15:18', '2025-06-29 19:18:45', '2025-06-29 19:18:45'),
(55, 1, 'payment_charge', 'Withdraw approval charge', 2990, 448.5, 0, 'approved', '29-06-2025 18:05', '2025-06-29 22:05:18', '2025-06-29 22:05:18'),
(56, 1, 'payment_charge', 'Withdraw approval charge', 817.2, 122.58, 0, 'approved', '30-06-2025 10:14', '2025-06-30 14:14:11', '2025-06-30 14:14:11'),
(57, 1, 'payment_charge', 'Withdraw approval charge', 2942, 441.3, 0, 'approved', '30-06-2025 11:19', '2025-06-30 15:19:38', '2025-06-30 15:19:38'),
(58, 1, 'payment_charge', 'Withdraw approval charge', 4000, 600, 0, 'approved', '30-06-2025 13:39', '2025-06-30 17:39:51', '2025-06-30 17:39:51'),
(59, 1, 'payment_charge', 'Withdraw approval charge', 3500, 525, 0, 'approved', '30-06-2025 13:58', '2025-06-30 17:58:03', '2025-06-30 17:58:03'),
(60, 1, 'payment_charge', 'Withdraw approval charge', 2107.6, 316.14, 0, 'approved', '30-06-2025 18:38', '2025-06-30 22:38:40', '2025-06-30 22:38:40'),
(61, 1, 'payment_charge', 'Withdraw approval charge', 308.2, 46.23, 0, 'approved', '01-07-2025 11:05', '2025-07-01 15:05:39', '2025-07-01 15:05:39'),
(62, 1, 'payment_charge', 'Withdraw approval charge', 1592.2, 238.83, 0, 'approved', '01-07-2025 13:14', '2025-07-01 07:14:54', '2025-07-01 07:14:54'),
(63, 1, 'payment_charge', 'Withdraw approval charge', 208, 31.2, 0, 'approved', '01-07-2025 15:31', '2025-07-01 09:31:57', '2025-07-01 09:31:57'),
(64, 1, 'payment_charge', 'Withdraw approval charge', 215, 32.25, 0, 'approved', '01-07-2025 16:03', '2025-07-01 10:03:05', '2025-07-01 10:03:05'),
(65, 1, 'payment_charge', 'Withdraw approval charge', 413, 61.95, 0, 'approved', '02-07-2025 10:14', '2025-07-02 04:14:59', '2025-07-02 04:14:59'),
(66, 1, 'payment_charge', 'Withdraw approval charge', 392, 58.8, 0, 'approved', '02-07-2025 10:16', '2025-07-02 04:16:11', '2025-07-02 04:16:11'),
(67, 1, 'payment_charge', 'Withdraw approval charge', 581.2, 87.18, 0, 'approved', '02-07-2025 10:17', '2025-07-02 04:17:18', '2025-07-02 04:17:18'),
(68, 1, 'payment_charge', 'Withdraw approval charge', 246, 36.9, 0, 'approved', '02-07-2025 10:23', '2025-07-02 04:23:29', '2025-07-02 04:23:29'),
(69, 1, 'payment_charge', 'Withdraw approval charge', 242, 36.3, 0, 'approved', '02-07-2025 10:25', '2025-07-02 04:25:29', '2025-07-02 04:25:29'),
(70, 1, 'payment_charge', 'Withdraw approval charge', 216, 32.4, 0, 'approved', '02-07-2025 10:37', '2025-07-02 04:37:34', '2025-07-02 04:37:34'),
(71, 1, 'payment_charge', 'Withdraw approval charge', 1450, 217.5, 0, 'approved', '02-07-2025 10:39', '2025-07-02 04:39:45', '2025-07-02 04:39:45'),
(72, 1, 'payment_charge', 'Withdraw approval charge', 204, 30.6, 0, 'approved', '02-07-2025 10:41', '2025-07-02 04:41:12', '2025-07-02 04:41:12'),
(73, 1, 'payment_charge', 'Withdraw approval charge', 318, 47.7, 0, 'approved', '02-07-2025 11:21', '2025-07-02 05:21:29', '2025-07-02 05:21:29'),
(74, 1, 'payment_charge', 'Withdraw approval charge', 244.2, 36.63, 0, 'approved', '02-07-2025 12:28', '2025-07-02 06:28:50', '2025-07-02 06:28:50'),
(75, 1, 'payment_charge', 'Withdraw approval charge', 398.4, 59.76, 0, 'approved', '02-07-2025 12:30', '2025-07-02 06:30:26', '2025-07-02 06:30:26'),
(76, 1, 'payment_charge', 'Withdraw approval charge', 681, 102.15, 0, 'approved', '02-07-2025 12:31', '2025-07-02 06:31:01', '2025-07-02 06:31:01'),
(77, 1, 'payment_charge', 'Withdraw approval charge', 272.2, 40.83, 0, 'approved', '02-07-2025 13:58', '2025-07-02 07:58:14', '2025-07-02 07:58:14'),
(78, 1, 'payment_charge', 'Withdraw approval charge', 710, 106.5, 0, 'approved', '02-07-2025 14:00', '2025-07-02 08:00:01', '2025-07-02 08:00:01'),
(79, 1, 'payment_charge', 'Withdraw approval charge', 688, 103.2, 0, 'approved', '02-07-2025 15:01', '2025-07-02 09:01:48', '2025-07-02 09:01:48'),
(80, 1, 'payment_charge', 'Withdraw approval charge', 211, 31.65, 0, 'approved', '02-07-2025 15:36', '2025-07-02 09:36:06', '2025-07-02 09:36:06'),
(81, 1, 'payment_charge', 'Withdraw approval charge', 407, 61.05, 0, 'approved', '02-07-2025 15:37', '2025-07-02 09:37:00', '2025-07-02 09:37:00'),
(82, 1, 'payment_charge', 'Withdraw approval charge', 400, 60, 0, 'approved', '02-07-2025 15:58', '2025-07-02 09:58:01', '2025-07-02 09:58:01'),
(83, 1, 'payment_charge', 'Withdraw approval charge', 2500, 375, 0, 'approved', '03-07-2025 10:53', '2025-07-03 04:53:46', '2025-07-03 04:53:46'),
(84, 1, 'payment_charge', 'Withdraw approval charge', 212, 31.8, 0, 'approved', '03-07-2025 10:55', '2025-07-03 04:55:48', '2025-07-03 04:55:48'),
(85, 1, 'payment_charge', 'Withdraw approval charge', 278, 41.7, 0, 'approved', '03-07-2025 10:56', '2025-07-03 04:56:55', '2025-07-03 04:56:55'),
(86, 1, 'payment_charge', 'Withdraw approval charge', 246, 36.9, 0, 'approved', '03-07-2025 10:58', '2025-07-03 04:58:54', '2025-07-03 04:58:54'),
(87, 1, 'payment_charge', 'Withdraw approval charge', 503.9, 75.59, 0, 'approved', '03-07-2025 11:00', '2025-07-03 05:00:30', '2025-07-03 05:00:30'),
(88, 1, 'payment_charge', 'Withdraw approval charge', 390, 58.5, 0, 'approved', '03-07-2025 11:01', '2025-07-03 05:01:51', '2025-07-03 05:01:51'),
(89, 1, 'payment_charge', 'Withdraw approval charge', 207, 31.05, 0, 'approved', '03-07-2025 11:05', '2025-07-03 05:05:34', '2025-07-03 05:05:34'),
(90, 1, 'payment_charge', 'Withdraw approval charge', 290, 43.5, 0, 'approved', '03-07-2025 11:06', '2025-07-03 05:06:13', '2025-07-03 05:06:13'),
(91, 1, 'payment_charge', 'Withdraw approval charge', 382.7, 57.41, 0, 'approved', '03-07-2025 11:06', '2025-07-03 05:06:57', '2025-07-03 05:06:57'),
(92, 1, 'payment_charge', 'Withdraw approval charge', 290, 43.5, 0, 'approved', '03-07-2025 11:08', '2025-07-03 05:08:00', '2025-07-03 05:08:00'),
(93, 1, 'payment_charge', 'Withdraw approval charge', 209, 31.35, 0, 'approved', '03-07-2025 11:08', '2025-07-03 05:08:56', '2025-07-03 05:08:56'),
(94, 1, 'payment_charge', 'Withdraw approval charge', 221, 33.15, 0, 'approved', '03-07-2025 11:09', '2025-07-03 05:09:37', '2025-07-03 05:09:37'),
(95, 1, 'payment_charge', 'Withdraw approval charge', 226, 33.9, 0, 'approved', '03-07-2025 11:10', '2025-07-03 05:10:15', '2025-07-03 05:10:15'),
(96, 1, 'payment_charge', 'Withdraw approval charge', 293, 43.95, 0, 'approved', '03-07-2025 11:11', '2025-07-03 05:11:10', '2025-07-03 05:11:10'),
(97, 1, 'payment_charge', 'Withdraw approval charge', 255, 38.25, 0, 'approved', '03-07-2025 11:11', '2025-07-03 05:11:44', '2025-07-03 05:11:44'),
(98, 1, 'payment_charge', 'Withdraw approval charge', 210.2, 31.53, 0, 'approved', '03-07-2025 11:12', '2025-07-03 05:12:24', '2025-07-03 05:12:24'),
(99, 1, 'payment_charge', 'Withdraw approval charge', 211, 31.65, 0, 'approved', '03-07-2025 11:13', '2025-07-03 05:13:00', '2025-07-03 05:13:00'),
(100, 1, 'payment_charge', 'Withdraw approval charge', 230, 34.5, 0, 'approved', '03-07-2025 11:44', '2025-07-03 05:44:41', '2025-07-03 05:44:41'),
(101, 1, 'payment_charge', 'Withdraw approval charge', 712.2, 106.83, 0, 'approved', '03-07-2025 13:00', '2025-07-03 07:00:12', '2025-07-03 07:00:12'),
(102, 1, 'payment_charge', 'Withdraw approval charge', 290, 43.5, 0, 'approved', '03-07-2025 13:07', '2025-07-03 07:07:24', '2025-07-03 07:07:24'),
(103, 1, 'payment_charge', 'Withdraw approval charge', 304.4, 45.66, 0, 'approved', '03-07-2025 14:02', '2025-07-03 08:02:11', '2025-07-03 08:02:11'),
(104, 1, 'payment_charge', 'Withdraw approval charge', 200, 30, 0, 'approved', '03-07-2025 14:43', '2025-07-03 08:43:13', '2025-07-03 08:43:13'),
(105, 1, 'payment_charge', 'Withdraw approval charge', 297, 44.55, 0, 'approved', '03-07-2025 14:53', '2025-07-03 08:53:43', '2025-07-03 08:53:43'),
(106, 1, 'payment_charge', 'Withdraw approval charge', 200, 30, 0, 'approved', '03-07-2025 15:25', '2025-07-03 09:25:54', '2025-07-03 09:25:54'),
(107, 1, 'payment_charge', 'Withdraw approval charge', 390, 58.5, 0, 'approved', '03-07-2025 15:46', '2025-07-03 09:46:43', '2025-07-03 09:46:43'),
(108, 1, 'payment_charge', 'Withdraw approval charge', 292, 43.8, 0, 'approved', '03-07-2025 15:47', '2025-07-03 09:47:33', '2025-07-03 09:47:33'),
(109, 1, 'payment_charge', 'Withdraw approval charge', 234, 35.1, 0, 'approved', '03-07-2025 15:56', '2025-07-03 09:56:15', '2025-07-03 09:56:15'),
(110, 1, 'payment_charge', 'Withdraw approval charge', 421, 63.15, 0, 'approved', '03-07-2025 15:56', '2025-07-03 09:56:54', '2025-07-03 09:56:54'),
(111, 1, 'payment_charge', 'Withdraw approval charge', 390, 58.5, 0, 'approved', '03-07-2025 16:18', '2025-07-03 10:18:18', '2025-07-03 10:18:18'),
(112, 1, 'payment_charge', 'Withdraw approval charge', 692, 103.8, 0, 'approved', '03-07-2025 16:20', '2025-07-03 10:20:05', '2025-07-03 10:20:05'),
(113, 1, 'payment_charge', 'Withdraw approval charge', 390, 58.5, 0, 'approved', '03-07-2025 16:59', '2025-07-03 10:59:10', '2025-07-03 10:59:10'),
(114, 1, 'payment_charge', 'Withdraw approval charge', 950, 142.5, 0, 'approved', '03-07-2025 16:59', '2025-07-03 10:59:57', '2025-07-03 10:59:57'),
(115, 1, 'payment_charge', 'Withdraw approval charge', 1340, 201, 0, 'approved', '03-07-2025 17:00', '2025-07-03 11:00:34', '2025-07-03 11:00:34'),
(116, 1, 'payment_charge', 'Withdraw approval charge', 229, 34.35, 0, 'approved', '04-07-2025 10:08', '2025-07-04 04:08:34', '2025-07-04 04:08:34'),
(117, 1, 'payment_charge', 'Withdraw approval charge', 608.2, 91.23, 0, 'approved', '04-07-2025 10:24', '2025-07-04 04:24:41', '2025-07-04 04:24:41'),
(118, 1, 'payment_charge', 'Withdraw approval charge', 897.2, 134.58, 0, 'approved', '04-07-2025 10:25', '2025-07-04 04:25:26', '2025-07-04 04:25:26'),
(119, 1, 'payment_charge', 'Withdraw approval charge', 706, 105.9, 0, 'approved', '04-07-2025 10:26', '2025-07-04 04:26:20', '2025-07-04 04:26:20'),
(120, 1, 'payment_charge', 'Withdraw approval charge', 723, 108.45, 0, 'approved', '04-07-2025 10:26', '2025-07-04 04:26:55', '2025-07-04 04:26:55'),
(121, 1, 'payment_charge', 'Withdraw approval charge', 213, 31.95, 0, 'approved', '04-07-2025 10:27', '2025-07-04 04:27:31', '2025-07-04 04:27:31'),
(122, 1, 'payment_charge', 'Withdraw approval charge', 409.4, 61.41, 0, 'approved', '04-07-2025 10:28', '2025-07-04 04:28:07', '2025-07-04 04:28:07'),
(123, 1, 'payment_charge', 'Withdraw approval charge', 214, 32.1, 0, 'approved', '04-07-2025 10:28', '2025-07-04 04:28:50', '2025-07-04 04:28:50'),
(124, 1, 'payment_charge', 'Withdraw approval charge', 291, 43.65, 0, 'approved', '04-07-2025 10:31', '2025-07-04 04:31:03', '2025-07-04 04:31:03'),
(125, 1, 'payment_charge', 'Withdraw approval charge', 1042, 156.3, 0, 'approved', '04-07-2025 10:32', '2025-07-04 04:32:00', '2025-07-04 04:32:00'),
(126, 1, 'payment_charge', 'Withdraw approval charge', 2554, 383.1, 0, 'approved', '04-07-2025 10:32', '2025-07-04 04:32:55', '2025-07-04 04:32:55'),
(127, 1, 'payment_charge', 'Withdraw approval charge', 209, 31.35, 0, 'approved', '04-07-2025 10:42', '2025-07-04 04:42:33', '2025-07-04 04:42:33'),
(128, 1, 'payment_charge', 'Withdraw approval charge', 5700, 855, 0, 'approved', '04-07-2025 10:43', '2025-07-04 04:43:59', '2025-07-04 04:43:59'),
(129, 1, 'payment_charge', 'Withdraw approval charge', 290, 43.5, 0, 'approved', '04-07-2025 11:22', '2025-07-04 05:22:33', '2025-07-04 05:22:33'),
(130, 1, 'payment_charge', 'Withdraw approval charge', 266, 39.9, 0, 'approved', '04-07-2025 11:23', '2025-07-04 05:23:21', '2025-07-04 05:23:21'),
(131, 1, 'payment_charge', 'Withdraw approval charge', 290, 43.5, 0, 'approved', '04-07-2025 11:41', '2025-07-04 05:41:58', '2025-07-04 05:41:58'),
(132, 1, 'payment_charge', 'Withdraw approval charge', 238, 35.7, 0, 'approved', '04-07-2025 11:42', '2025-07-04 05:42:36', '2025-07-04 05:42:36'),
(133, 1, 'payment_charge', 'Withdraw approval charge', 874.4, 131.16, 0, 'approved', '04-07-2025 11:45', '2025-07-04 05:45:13', '2025-07-04 05:45:13'),
(134, 1, 'payment_charge', 'Withdraw approval charge', 240, 36, 0, 'approved', '04-07-2025 11:53', '2025-07-04 05:53:53', '2025-07-04 05:53:53'),
(135, 1, 'payment_charge', 'Withdraw approval charge', 622, 93.3, 0, 'approved', '04-07-2025 11:55', '2025-07-04 05:55:28', '2025-07-04 05:55:28'),
(136, 1, 'payment_charge', 'Withdraw approval charge', 293, 43.95, 0, 'approved', '04-07-2025 14:45', '2025-07-04 08:45:38', '2025-07-04 08:45:38'),
(137, 1, 'payment_charge', 'Withdraw approval charge', 234, 35.1, 0, 'approved', '04-07-2025 14:48', '2025-07-04 08:48:19', '2025-07-04 08:48:19'),
(138, 1, 'payment_charge', 'Withdraw approval charge', 222.2, 33.33, 0, 'approved', '04-07-2025 14:49', '2025-07-04 08:49:16', '2025-07-04 08:49:16'),
(139, 1, 'payment_charge', 'Withdraw approval charge', 230, 34.5, 0, 'approved', '04-07-2025 14:49', '2025-07-04 08:49:52', '2025-07-04 08:49:52'),
(140, 1, 'payment_charge', 'Withdraw approval charge', 396, 59.4, 0, 'approved', '04-07-2025 14:50', '2025-07-04 08:50:24', '2025-07-04 08:50:24'),
(141, 1, 'payment_charge', 'Withdraw approval charge', 219, 32.85, 0, 'approved', '04-07-2025 14:52', '2025-07-04 08:52:33', '2025-07-04 08:52:33'),
(142, 1, 'payment_charge', 'Withdraw approval charge', 306, 45.9, 0, 'approved', '04-07-2025 15:26', '2025-07-04 09:26:29', '2025-07-04 09:26:29'),
(143, 1, 'payment_charge', 'Withdraw approval charge', 350, 52.5, 0, 'approved', '04-07-2025 15:27', '2025-07-04 09:27:12', '2025-07-04 09:27:12'),
(144, 1, 'payment_charge', 'Withdraw approval charge', 489.1, 73.37, 0, 'approved', '04-07-2025 15:27', '2025-07-04 09:27:47', '2025-07-04 09:27:47'),
(145, 1, 'payment_charge', 'Withdraw approval charge', 213, 31.95, 0, 'approved', '04-07-2025 15:28', '2025-07-04 09:28:30', '2025-07-04 09:28:30'),
(146, 1, 'payment_charge', 'Withdraw approval charge', 542.7, 81.41, 0, 'approved', '04-07-2025 15:29', '2025-07-04 09:29:17', '2025-07-04 09:29:17'),
(147, 1, 'payment_charge', 'Withdraw approval charge', 342, 51.3, 0, 'approved', '04-07-2025 15:39', '2025-07-04 09:39:03', '2025-07-04 09:39:03'),
(148, 1, 'payment_charge', 'Withdraw approval charge', 210, 31.5, 0, 'approved', '04-07-2025 15:57', '2025-07-04 09:57:08', '2025-07-04 09:57:08'),
(149, 1, 'payment_charge', 'Withdraw approval charge', 305, 45.75, 0, 'approved', '04-07-2025 15:58', '2025-07-04 09:58:25', '2025-07-04 09:58:25'),
(150, 1, 'payment_charge', 'Withdraw approval charge', 306, 45.9, 0, 'approved', '04-07-2025 16:07', '2025-07-04 10:07:20', '2025-07-04 10:07:20'),
(151, 1, 'payment_charge', 'Withdraw approval charge', 425.1, 63.77, 0, 'approved', '04-07-2025 16:08', '2025-07-04 10:08:20', '2025-07-04 10:08:20'),
(152, 1, 'payment_charge', 'Withdraw approval charge', 917, 137.55, 0, 'approved', '04-07-2025 16:09', '2025-07-04 10:09:09', '2025-07-04 10:09:09'),
(153, 1, 'payment_charge', 'Withdraw approval charge', 1158, 173.7, 0, 'approved', '04-07-2025 16:10', '2025-07-04 10:10:33', '2025-07-04 10:10:33'),
(154, 1, 'payment_charge', 'Withdraw approval charge', 290, 43.5, 0, 'approved', '04-07-2025 16:33', '2025-07-04 10:33:23', '2025-07-04 10:33:23'),
(155, 1, 'payment_charge', 'Withdraw approval charge', 305, 45.75, 0, 'approved', '05-07-2025 10:05', '2025-07-05 04:05:22', '2025-07-05 04:05:22'),
(156, 1, 'payment_charge', 'Withdraw approval charge', 14120, 2118, 0, 'approved', '05-07-2025 10:18', '2025-07-05 04:18:51', '2025-07-05 04:18:51'),
(157, 1, 'payment_charge', 'Withdraw approval charge', 227.2, 34.08, 0, 'approved', '05-07-2025 10:21', '2025-07-05 04:21:03', '2025-07-05 04:21:03'),
(158, 1, 'payment_charge', 'Withdraw approval charge', 220, 33, 0, 'approved', '05-07-2025 10:31', '2025-07-05 04:31:23', '2025-07-05 04:31:23'),
(159, 1, 'payment_charge', 'Withdraw approval charge', 310.3, 46.55, 0, 'approved', '05-07-2025 10:32', '2025-07-05 04:32:11', '2025-07-05 04:32:11'),
(160, 1, 'payment_charge', 'Withdraw approval charge', 219, 32.85, 0, 'approved', '05-07-2025 10:32', '2025-07-05 04:32:55', '2025-07-05 04:32:55'),
(161, 1, 'payment_charge', 'Withdraw approval charge', 284.2, 42.63, 0, 'approved', '05-07-2025 10:33', '2025-07-05 04:33:41', '2025-07-05 04:33:41'),
(162, 1, 'payment_charge', 'Withdraw approval charge', 361, 54.15, 0, 'approved', '05-07-2025 10:34', '2025-07-05 04:34:23', '2025-07-05 04:34:23'),
(163, 1, 'payment_charge', 'Withdraw approval charge', 386.2, 57.93, 0, 'approved', '05-07-2025 10:35', '2025-07-05 04:35:01', '2025-07-05 04:35:01'),
(164, 1, 'payment_charge', 'Withdraw approval charge', 290, 43.5, 0, 'approved', '05-07-2025 10:35', '2025-07-05 04:35:39', '2025-07-05 04:35:39'),
(165, 1, 'payment_charge', 'Withdraw approval charge', 228.2, 34.23, 0, 'approved', '05-07-2025 10:36', '2025-07-05 04:36:17', '2025-07-05 04:36:17'),
(166, 1, 'payment_charge', 'Withdraw approval charge', 470, 70.5, 0, 'approved', '05-07-2025 10:37', '2025-07-05 04:37:00', '2025-07-05 04:37:00'),
(167, 1, 'payment_charge', 'Withdraw approval charge', 615, 92.25, 0, 'approved', '05-07-2025 10:37', '2025-07-05 04:37:37', '2025-07-05 04:37:37'),
(168, 1, 'payment_charge', 'Withdraw approval charge', 567, 85.05, 0, 'approved', '05-07-2025 10:38', '2025-07-05 04:38:12', '2025-07-05 04:38:12'),
(169, 1, 'payment_charge', 'Withdraw approval charge', 1300, 195, 0, 'approved', '05-07-2025 10:38', '2025-07-05 04:38:46', '2025-07-05 04:38:46'),
(170, 1, 'payment_charge', 'Withdraw approval charge', 4290, 643.5, 0, 'approved', '05-07-2025 10:58', '2025-07-05 04:58:16', '2025-07-05 04:58:16'),
(171, 1, 'payment_charge', 'Withdraw approval charge', 791, 118.65, 0, 'approved', '05-07-2025 10:58', '2025-07-05 04:58:40', '2025-07-05 04:58:40'),
(172, 1, 'payment_charge', 'Withdraw approval charge', 297, 44.55, 0, 'approved', '05-07-2025 11:18', '2025-07-05 05:18:35', '2025-07-05 05:18:35'),
(173, 1, 'payment_charge', 'Withdraw approval charge', 304, 45.6, 0, 'approved', '05-07-2025 11:19', '2025-07-05 05:19:16', '2025-07-05 05:19:16'),
(174, 1, 'payment_charge', 'Withdraw approval charge', 2000, 300, 0, 'approved', '05-07-2025 11:25', '2025-07-05 05:25:59', '2025-07-05 05:25:59'),
(175, 1, 'payment_charge', 'Withdraw approval charge', 209, 31.35, 0, 'approved', '05-07-2025 11:43', '2025-07-05 05:43:16', '2025-07-05 05:43:16'),
(176, 1, 'payment_charge', 'Withdraw approval charge', 236, 35.4, 0, 'approved', '05-07-2025 11:44', '2025-07-05 05:44:06', '2025-07-05 05:44:06'),
(177, 1, 'payment_charge', 'Withdraw approval charge', 804, 120.6, 0, 'approved', '05-07-2025 11:44', '2025-07-05 05:44:46', '2025-07-05 05:44:46'),
(178, 1, 'payment_charge', 'Withdraw approval charge', 346, 51.9, 0, 'approved', '05-07-2025 12:11', '2025-07-05 06:11:13', '2025-07-05 06:11:13'),
(179, 1, 'payment_charge', 'Withdraw approval charge', 250, 37.5, 0, 'approved', '05-07-2025 12:18', '2025-07-05 06:18:21', '2025-07-05 06:18:21'),
(180, 1, 'payment_charge', 'Withdraw approval charge', 472, 70.8, 0, 'approved', '05-07-2025 12:19', '2025-07-05 06:19:23', '2025-07-05 06:19:23'),
(181, 1, 'payment_charge', 'Withdraw approval charge', 209, 31.35, 0, 'approved', '05-07-2025 12:28', '2025-07-05 06:28:32', '2025-07-05 06:28:32'),
(182, 1, 'payment_charge', 'Withdraw approval charge', 243, 36.45, 0, 'approved', '05-07-2025 12:41', '2025-07-05 06:41:26', '2025-07-05 06:41:26'),
(183, 1, 'payment_charge', 'Withdraw approval charge', 295.1, 44.27, 0, 'approved', '05-07-2025 12:42', '2025-07-05 06:42:00', '2025-07-05 06:42:00'),
(184, 1, 'payment_charge', 'Withdraw approval charge', 390, 58.5, 0, 'approved', '05-07-2025 12:42', '2025-07-05 06:42:34', '2025-07-05 06:42:34'),
(185, 1, 'payment_charge', 'Withdraw approval charge', 255, 38.25, 0, 'approved', '05-07-2025 12:52', '2025-07-05 06:52:46', '2025-07-05 06:52:46'),
(186, 1, 'payment_charge', 'Withdraw approval charge', 235, 35.25, 0, 'approved', '05-07-2025 12:53', '2025-07-05 06:53:22', '2025-07-05 06:53:22'),
(187, 1, 'payment_charge', 'Withdraw approval charge', 2972, 445.8, 0, 'approved', '05-07-2025 13:03', '2025-07-05 07:03:09', '2025-07-05 07:03:09'),
(188, 1, 'payment_charge', 'Withdraw approval charge', 200, 30, 0, 'approved', '05-07-2025 13:03', '2025-07-05 07:03:35', '2025-07-05 07:03:35'),
(189, 1, 'payment_charge', 'Withdraw approval charge', 270, 40.5, 0, 'approved', '05-07-2025 13:20', '2025-07-05 07:20:15', '2025-07-05 07:20:15'),
(190, 1, 'payment_charge', 'Withdraw approval charge', 381, 57.15, 0, 'approved', '05-07-2025 13:21', '2025-07-05 07:21:03', '2025-07-05 07:21:03'),
(191, 1, 'payment_charge', 'Withdraw approval charge', 421, 63.15, 0, 'approved', '05-07-2025 13:21', '2025-07-05 07:21:48', '2025-07-05 07:21:48'),
(192, 1, 'payment_charge', 'Withdraw approval charge', 290, 43.5, 0, 'approved', '05-07-2025 13:38', '2025-07-05 07:38:38', '2025-07-05 07:38:38'),
(193, 1, 'payment_charge', 'Withdraw approval charge', 220, 33, 0, 'approved', '05-07-2025 13:45', '2025-07-05 07:45:25', '2025-07-05 07:45:25'),
(194, 1, 'payment_charge', 'Withdraw approval charge', 205, 30.75, 0, 'approved', '05-07-2025 14:04', '2025-07-05 08:04:18', '2025-07-05 08:04:18'),
(195, 1, 'payment_charge', 'Withdraw approval charge', 404.4, 60.66, 0, 'approved', '05-07-2025 14:05', '2025-07-05 08:05:05', '2025-07-05 08:05:05'),
(196, 1, 'payment_charge', 'Withdraw approval charge', 211, 31.65, 0, 'approved', '05-07-2025 14:05', '2025-07-05 08:05:47', '2025-07-05 08:05:47'),
(197, 1, 'payment_charge', 'Withdraw approval charge', 291, 43.65, 0, 'approved', '05-07-2025 14:40', '2025-07-05 08:40:13', '2025-07-05 08:40:13'),
(198, 1, 'payment_charge', 'Withdraw approval charge', 205, 30.75, 0, 'approved', '05-07-2025 14:59', '2025-07-05 08:59:04', '2025-07-05 08:59:04'),
(199, 1, 'payment_charge', 'Withdraw approval charge', 437.1, 65.57, 0, 'approved', '05-07-2025 15:00', '2025-07-05 09:00:12', '2025-07-05 09:00:12'),
(200, 1, 'payment_charge', 'Withdraw approval charge', 296.2, 44.43, 0, 'approved', '05-07-2025 15:00', '2025-07-05 09:00:47', '2025-07-05 09:00:47'),
(201, 1, 'payment_charge', 'Withdraw approval charge', 2656, 398.4, 0, 'approved', '05-07-2025 15:07', '2025-07-05 09:07:32', '2025-07-05 09:07:32'),
(202, 1, 'payment_charge', 'Withdraw approval charge', 1301.2, 195.18, 0, 'approved', '05-07-2025 15:09', '2025-07-05 09:09:18', '2025-07-05 09:09:18'),
(203, 1, 'payment_charge', 'Withdraw approval charge', 219, 32.85, 0, 'approved', '05-07-2025 15:49', '2025-07-05 09:49:07', '2025-07-05 09:49:07'),
(204, 1, 'payment_charge', 'Withdraw approval charge', 291, 43.65, 0, 'approved', '05-07-2025 15:49', '2025-07-05 09:49:54', '2025-07-05 09:49:54'),
(205, 1, 'payment_charge', 'Withdraw approval charge', 299, 44.85, 0, 'approved', '05-07-2025 15:50', '2025-07-05 09:50:27', '2025-07-05 09:50:27'),
(206, 1, 'payment_charge', 'Withdraw approval charge', 285, 42.75, 0, 'approved', '05-07-2025 16:00', '2025-07-05 10:00:28', '2025-07-05 10:00:28'),
(207, 1, 'payment_charge', 'Withdraw approval charge', 290, 43.5, 0, 'approved', '05-07-2025 16:01', '2025-07-05 10:01:12', '2025-07-05 10:01:12'),
(208, 1, 'payment_charge', 'Withdraw approval charge', 209, 31.35, 0, 'approved', '05-07-2025 16:03', '2025-07-05 10:03:36', '2025-07-05 10:03:36'),
(209, 1, 'payment_charge', 'Withdraw approval charge', 281, 42.15, 0, 'approved', '05-07-2025 16:08', '2025-07-05 10:08:59', '2025-07-05 10:08:59'),
(210, 1, 'payment_charge', 'Withdraw approval charge', 293, 43.95, 0, 'approved', '05-07-2025 16:10', '2025-07-05 10:10:03', '2025-07-05 10:10:03'),
(211, 1, 'payment_charge', 'Withdraw approval charge', 253, 37.95, 0, 'approved', '05-07-2025 16:38', '2025-07-05 10:38:31', '2025-07-05 10:38:31'),
(212, 1, 'payment_charge', 'Withdraw approval charge', 229, 34.35, 0, 'approved', '05-07-2025 16:39', '2025-07-05 10:39:01', '2025-07-05 10:39:01'),
(213, 1, 'payment_charge', 'Withdraw approval charge', 205, 30.75, 0, 'approved', '06-07-2025 10:10', '2025-07-06 04:10:46', '2025-07-06 04:10:46'),
(214, 1, 'payment_charge', 'Withdraw approval charge', 4348.2, 652.23, 0, 'approved', '06-07-2025 10:25', '2025-07-06 04:25:15', '2025-07-06 04:25:15'),
(215, 1, 'payment_charge', 'Withdraw approval charge', 589, 88.35, 0, 'approved', '06-07-2025 10:25', '2025-07-06 04:25:34', '2025-07-06 04:25:34'),
(216, 1, 'payment_charge', 'Withdraw approval charge', 220, 33, 0, 'approved', '06-07-2025 10:26', '2025-07-06 04:26:07', '2025-07-06 04:26:07'),
(217, 1, 'payment_charge', 'Withdraw approval charge', 326, 48.9, 0, 'approved', '06-07-2025 10:26', '2025-07-06 04:26:50', '2025-07-06 04:26:50'),
(218, 1, 'payment_charge', 'Withdraw approval charge', 789, 118.35, 0, 'approved', '06-07-2025 10:27', '2025-07-06 04:27:37', '2025-07-06 04:27:37'),
(219, 1, 'payment_charge', 'Withdraw approval charge', 673, 100.95, 0, 'approved', '06-07-2025 10:28', '2025-07-06 04:28:26', '2025-07-06 04:28:26'),
(220, 1, 'payment_charge', 'Withdraw approval charge', 263, 39.45, 0, 'approved', '06-07-2025 10:29', '2025-07-06 04:29:04', '2025-07-06 04:29:04'),
(221, 1, 'payment_charge', 'Withdraw approval charge', 290, 43.5, 0, 'approved', '06-07-2025 10:29', '2025-07-06 04:29:42', '2025-07-06 04:29:42'),
(222, 1, 'payment_charge', 'Withdraw approval charge', 1300, 195, 0, 'approved', '06-07-2025 10:30', '2025-07-06 04:30:28', '2025-07-06 04:30:28'),
(223, 1, 'payment_charge', 'Withdraw approval charge', 205, 30.75, 0, 'approved', '06-07-2025 10:31', '2025-07-06 04:31:06', '2025-07-06 04:31:06'),
(224, 1, 'payment_charge', 'Withdraw approval charge', 6500, 975, 0, 'approved', '06-07-2025 10:31', '2025-07-06 04:31:14', '2025-07-06 04:31:14'),
(225, 1, 'payment_charge', 'Withdraw approval charge', 210, 31.5, 0, 'approved', '06-07-2025 10:31', '2025-07-06 04:31:59', '2025-07-06 04:31:59'),
(226, 1, 'payment_charge', 'Withdraw approval charge', 1010, 151.5, 0, 'approved', '06-07-2025 10:32', '2025-07-06 04:32:35', '2025-07-06 04:32:35'),
(227, 1, 'payment_charge', 'Withdraw approval charge', 232.3, 34.85, 0, 'approved', '06-07-2025 10:33', '2025-07-06 04:33:11', '2025-07-06 04:33:11'),
(228, 1, 'payment_charge', 'Withdraw approval charge', 350, 52.5, 0, 'approved', '06-07-2025 10:33', '2025-07-06 04:33:42', '2025-07-06 04:33:42'),
(229, 1, 'payment_charge', 'Withdraw approval charge', 226, 33.9, 0, 'approved', '06-07-2025 10:53', '2025-07-06 04:53:59', '2025-07-06 04:53:59'),
(230, 1, 'payment_charge', 'Withdraw approval charge', 400, 60, 0, 'approved', '06-07-2025 10:54', '2025-07-06 04:54:40', '2025-07-06 04:54:40'),
(231, 1, 'payment_charge', 'Withdraw approval charge', 407.2, 61.08, 0, 'approved', '06-07-2025 10:55', '2025-07-06 04:55:14', '2025-07-06 04:55:14'),
(232, 1, 'payment_charge', 'Withdraw approval charge', 337.3, 50.6, 0, 'approved', '06-07-2025 10:55', '2025-07-06 04:55:58', '2025-07-06 04:55:58'),
(233, 1, 'payment_charge', 'Withdraw approval charge', 233, 34.95, 0, 'approved', '06-07-2025 10:56', '2025-07-06 04:56:31', '2025-07-06 04:56:31'),
(234, 1, 'payment_charge', 'Withdraw approval charge', 290, 43.5, 0, 'approved', '06-07-2025 10:57', '2025-07-06 04:57:10', '2025-07-06 04:57:10'),
(235, 1, 'payment_charge', 'Withdraw approval charge', 210, 31.5, 0, 'approved', '06-07-2025 10:57', '2025-07-06 04:57:50', '2025-07-06 04:57:50'),
(236, 1, 'payment_charge', 'Withdraw approval charge', 219, 32.85, 0, 'approved', '06-07-2025 10:58', '2025-07-06 04:58:26', '2025-07-06 04:58:26'),
(237, 1, 'payment_charge', 'Withdraw approval charge', 477, 71.55, 0, 'approved', '06-07-2025 10:59', '2025-07-06 04:59:21', '2025-07-06 04:59:21'),
(238, 1, 'payment_charge', 'Withdraw approval charge', 292, 43.8, 0, 'approved', '06-07-2025 11:07', '2025-07-06 05:07:35', '2025-07-06 05:07:35'),
(239, 1, 'payment_charge', 'Withdraw approval charge', 519.3, 77.9, 0, 'approved', '06-07-2025 11:08', '2025-07-06 05:08:47', '2025-07-06 05:08:47'),
(240, 1, 'payment_charge', 'Withdraw approval charge', 208, 31.2, 0, 'approved', '06-07-2025 11:09', '2025-07-06 05:09:38', '2025-07-06 05:09:38'),
(241, 1, 'payment_charge', 'Withdraw approval charge', 238, 35.7, 0, 'approved', '06-07-2025 11:55', '2025-07-06 05:55:08', '2025-07-06 05:55:08'),
(242, 1, 'payment_charge', 'Withdraw approval charge', 290, 43.5, 0, 'approved', '06-07-2025 11:56', '2025-07-06 05:56:03', '2025-07-06 05:56:03'),
(243, 1, 'payment_charge', 'Withdraw approval charge', 290.2, 43.53, 0, 'approved', '06-07-2025 11:56', '2025-07-06 05:56:40', '2025-07-06 05:56:40'),
(244, 1, 'payment_charge', 'Withdraw approval charge', 412, 61.8, 0, 'approved', '06-07-2025 11:57', '2025-07-06 05:57:11', '2025-07-06 05:57:11'),
(245, 1, 'payment_charge', 'Withdraw approval charge', 661, 99.15, 0, 'approved', '06-07-2025 11:58', '2025-07-06 05:58:14', '2025-07-06 05:58:14'),
(246, 1, 'payment_charge', 'Withdraw approval charge', 297.2, 44.58, 0, 'approved', '06-07-2025 12:29', '2025-07-06 06:29:28', '2025-07-06 06:29:28'),
(247, 1, 'payment_charge', 'Withdraw approval charge', 206, 30.9, 0, 'approved', '06-07-2025 12:40', '2025-07-06 06:40:03', '2025-07-06 06:40:03'),
(248, 1, 'payment_charge', 'Withdraw approval charge', 259, 38.85, 0, 'approved', '06-07-2025 12:40', '2025-07-06 06:40:48', '2025-07-06 06:40:48'),
(249, 1, 'payment_charge', 'Withdraw approval charge', 211, 31.65, 0, 'approved', '06-07-2025 12:41', '2025-07-06 06:41:37', '2025-07-06 06:41:37'),
(250, 1, 'payment_charge', 'Withdraw approval charge', 210, 31.5, 0, 'approved', '06-07-2025 12:42', '2025-07-06 06:42:11', '2025-07-06 06:42:11'),
(251, 1, 'payment_charge', 'Withdraw approval charge', 233, 34.95, 0, 'approved', '06-07-2025 12:42', '2025-07-06 06:42:51', '2025-07-06 06:42:51'),
(252, 1, 'payment_charge', 'Withdraw approval charge', 352, 52.8, 0, 'approved', '06-07-2025 12:43', '2025-07-06 06:43:31', '2025-07-06 06:43:31'),
(253, 1, 'payment_charge', 'Withdraw approval charge', 208, 31.2, 0, 'approved', '06-07-2025 12:59', '2025-07-06 06:59:48', '2025-07-06 06:59:48'),
(254, 1, 'payment_charge', 'Withdraw approval charge', 200, 30, 0, 'approved', '06-07-2025 13:16', '2025-07-06 07:16:00', '2025-07-06 07:16:00'),
(255, 1, 'payment_charge', 'Withdraw approval charge', 213, 31.95, 0, 'approved', '06-07-2025 13:16', '2025-07-06 07:16:38', '2025-07-06 07:16:38'),
(256, 1, 'payment_charge', 'Withdraw approval charge', 242, 36.3, 0, 'approved', '06-07-2025 13:21', '2025-07-06 07:21:51', '2025-07-06 07:21:51'),
(257, 1, 'payment_charge', 'Withdraw approval charge', 231, 34.65, 0, 'approved', '06-07-2025 13:22', '2025-07-06 07:22:25', '2025-07-06 07:22:25'),
(258, 1, 'payment_charge', 'Withdraw approval charge', 368, 55.2, 0, 'approved', '06-07-2025 13:23', '2025-07-06 07:23:07', '2025-07-06 07:23:07'),
(259, 1, 'payment_charge', 'Withdraw approval charge', 685.1, 102.77, 0, 'approved', '06-07-2025 13:23', '2025-07-06 07:23:39', '2025-07-06 07:23:39'),
(260, 1, 'payment_charge', 'Withdraw approval charge', 290, 43.5, 0, 'approved', '06-07-2025 13:39', '2025-07-06 07:39:01', '2025-07-06 07:39:01'),
(261, 1, 'payment_charge', 'Withdraw approval charge', 211, 31.65, 0, 'approved', '06-07-2025 13:54', '2025-07-06 07:54:54', '2025-07-06 07:54:54'),
(262, 1, 'payment_charge', 'Withdraw approval charge', 246, 36.9, 0, 'approved', '06-07-2025 13:56', '2025-07-06 07:56:55', '2025-07-06 07:56:55'),
(263, 1, 'payment_charge', 'Withdraw approval charge', 1202, 180.3, 0, 'approved', '06-07-2025 14:06', '2025-07-06 08:06:52', '2025-07-06 08:06:52'),
(264, 1, 'payment_charge', 'Withdraw approval charge', 259, 38.85, 0, 'approved', '06-07-2025 14:20', '2025-07-06 08:20:24', '2025-07-06 08:20:24'),
(265, 1, 'payment_charge', 'Withdraw approval charge', 240, 36, 0, 'approved', '06-07-2025 14:33', '2025-07-06 08:33:13', '2025-07-06 08:33:13'),
(266, 1, 'payment_charge', 'Withdraw approval charge', 200, 30, 0, 'approved', '06-07-2025 14:34', '2025-07-06 08:34:33', '2025-07-06 08:34:33'),
(267, 1, 'payment_charge', 'Withdraw approval charge', 299, 44.85, 0, 'approved', '06-07-2025 14:50', '2025-07-06 08:50:42', '2025-07-06 08:50:42'),
(268, 1, 'payment_charge', 'Withdraw approval charge', 200, 30, 0, 'approved', '06-07-2025 14:51', '2025-07-06 08:51:28', '2025-07-06 08:51:28'),
(269, 1, 'payment_charge', 'Withdraw approval charge', 210, 31.5, 0, 'approved', '06-07-2025 14:52', '2025-07-06 08:52:25', '2025-07-06 08:52:25'),
(270, 1, 'payment_charge', 'Withdraw approval charge', 233, 34.95, 0, 'approved', '06-07-2025 14:53', '2025-07-06 08:53:17', '2025-07-06 08:53:17'),
(271, 1, 'payment_charge', 'Withdraw approval charge', 349.2, 52.38, 0, 'approved', '06-07-2025 14:54', '2025-07-06 08:54:49', '2025-07-06 08:54:49'),
(272, 1, 'payment_charge', 'Withdraw approval charge', 235, 35.25, 0, 'approved', '06-07-2025 14:56', '2025-07-06 08:56:07', '2025-07-06 08:56:07'),
(273, 1, 'payment_charge', 'Withdraw approval charge', 475, 71.25, 0, 'approved', '06-07-2025 15:33', '2025-07-06 09:33:51', '2025-07-06 09:33:51'),
(274, 1, 'payment_charge', 'Withdraw approval charge', 347.2, 52.08, 0, 'approved', '06-07-2025 15:35', '2025-07-06 09:35:20', '2025-07-06 09:35:20'),
(275, 1, 'payment_charge', 'Withdraw approval charge', 340, 51, 0, 'approved', '06-07-2025 15:35', '2025-07-06 09:35:51', '2025-07-06 09:35:51'),
(276, 1, 'payment_charge', 'Withdraw approval charge', 1530.2, 229.53, 0, 'approved', '06-07-2025 15:37', '2025-07-06 09:37:43', '2025-07-06 09:37:43'),
(277, 1, 'payment_charge', 'Withdraw approval charge', 204, 30.6, 0, 'approved', '06-07-2025 15:59', '2025-07-06 09:59:10', '2025-07-06 09:59:10'),
(278, 1, 'payment_charge', 'Withdraw approval charge', 216, 32.4, 0, 'approved', '06-07-2025 15:59', '2025-07-06 09:59:52', '2025-07-06 09:59:52'),
(279, 1, 'payment_charge', 'Withdraw approval charge', 300.2, 45.03, 0, 'approved', '06-07-2025 16:00', '2025-07-06 10:00:17', '2025-07-06 10:00:17'),
(280, 1, 'payment_charge', 'Withdraw approval charge', 306, 45.9, 0, 'approved', '06-07-2025 16:00', '2025-07-06 10:00:39', '2025-07-06 10:00:39'),
(281, 1, 'payment_charge', 'Withdraw approval charge', 821.7, 123.26, 0, 'approved', '06-07-2025 16:01', '2025-07-06 10:01:48', '2025-07-06 10:01:48'),
(282, 1, 'payment_charge', 'Withdraw approval charge', 290, 43.5, 0, 'approved', '06-07-2025 16:04', '2025-07-06 10:04:37', '2025-07-06 10:04:37'),
(283, 1, 'payment_charge', 'Withdraw approval charge', 532.4, 79.86, 0, 'approved', '06-07-2025 16:15', '2025-07-06 10:15:02', '2025-07-06 10:15:02'),
(284, 1, 'payment_charge', 'Withdraw approval charge', 1626, 243.9, 0, 'approved', '08-07-2025 07:01', '2025-07-08 01:01:04', '2025-07-08 01:01:04'),
(285, 1, 'payment_charge', 'Withdraw approval charge', 200, 30, 0, 'approved', '08-07-2025 07:01', '2025-07-08 01:01:11', '2025-07-08 01:01:11'),
(286, 1, 'payment_charge', 'Withdraw approval charge', 600, 90, 0, 'approved', '08-07-2025 07:01', '2025-07-08 01:01:19', '2025-07-08 01:01:19'),
(287, 1, 'payment_charge', 'Withdraw approval charge', 1027, 154.05, 0, 'approved', '08-07-2025 07:01', '2025-07-08 01:01:31', '2025-07-08 01:01:31'),
(288, 1, 'payment_charge', 'Withdraw approval charge', 2190, 328.5, 0, 'approved', '08-07-2025 07:01', '2025-07-08 01:01:40', '2025-07-08 01:01:40'),
(289, 1, 'payment_charge', 'Withdraw approval charge', 473, 70.95, 0, 'approved', '08-07-2025 07:01', '2025-07-08 01:01:47', '2025-07-08 01:01:47'),
(290, 1, 'payment_charge', 'Withdraw approval charge', 300, 45, 0, 'approved', '08-07-2025 07:01', '2025-07-08 01:01:56', '2025-07-08 01:01:56'),
(291, 1, 'payment_charge', 'Withdraw approval charge', 1182, 177.3, 0, 'approved', '08-07-2025 07:02', '2025-07-08 01:02:02', '2025-07-08 01:02:02'),
(292, 1, 'payment_charge', 'Withdraw approval charge', 290, 43.5, 0, 'approved', '08-07-2025 07:02', '2025-07-08 01:02:11', '2025-07-08 01:02:11'),
(293, 1, 'payment_charge', 'Withdraw approval charge', 297, 44.55, 0, 'approved', '08-07-2025 07:02', '2025-07-08 01:02:18', '2025-07-08 01:02:18'),
(294, 1, 'payment_charge', 'Withdraw approval charge', 303, 45.45, 0, 'approved', '08-07-2025 07:02', '2025-07-08 01:02:25', '2025-07-08 01:02:25'),
(295, 1, 'payment_charge', 'Withdraw approval charge', 566, 84.9, 0, 'approved', '08-07-2025 07:02', '2025-07-08 01:02:34', '2025-07-08 01:02:34'),
(296, 1, 'payment_charge', 'Withdraw approval charge', 235, 35.25, 0, 'approved', '08-07-2025 07:02', '2025-07-08 01:02:40', '2025-07-08 01:02:40'),
(297, 1, 'payment_charge', 'Withdraw approval charge', 8168, 1225.2, 0, 'approved', '08-07-2025 07:02', '2025-07-08 01:02:51', '2025-07-08 01:02:51'),
(298, 1, 'payment_charge', 'Withdraw approval charge', 236, 35.4, 0, 'approved', '08-07-2025 07:02', '2025-07-08 01:02:59', '2025-07-08 01:02:59'),
(299, 1, 'payment_charge', 'Withdraw approval charge', 205, 30.75, 0, 'approved', '08-07-2025 07:03', '2025-07-08 01:03:06', '2025-07-08 01:03:06'),
(300, 1, 'payment_charge', 'Withdraw approval charge', 390, 58.5, 0, 'approved', '08-07-2025 07:03', '2025-07-08 01:03:13', '2025-07-08 01:03:13'),
(301, 1, 'payment_charge', 'Withdraw approval charge', 203, 30.45, 0, 'approved', '08-07-2025 07:03', '2025-07-08 01:03:24', '2025-07-08 01:03:24'),
(302, 1, 'payment_charge', 'Withdraw approval charge', 200, 30, 0, 'approved', '08-07-2025 07:03', '2025-07-08 01:03:30', '2025-07-08 01:03:30'),
(303, 1, 'payment_charge', 'Withdraw approval charge', 342.2, 51.33, 0, 'approved', '08-07-2025 07:03', '2025-07-08 01:03:36', '2025-07-08 01:03:36'),
(304, 1, 'payment_charge', 'Withdraw approval charge', 305, 45.75, 0, 'approved', '08-07-2025 07:03', '2025-07-08 01:03:42', '2025-07-08 01:03:42'),
(305, 1, 'payment_charge', 'Withdraw approval charge', 304, 45.6, 0, 'approved', '08-07-2025 07:03', '2025-07-08 01:03:48', '2025-07-08 01:03:48'),
(306, 1, 'payment_charge', 'Withdraw approval charge', 305, 45.75, 0, 'approved', '08-07-2025 07:03', '2025-07-08 01:03:54', '2025-07-08 01:03:54'),
(307, 1, 'payment_charge', 'Withdraw approval charge', 3036, 455.4, 0, 'approved', '08-07-2025 07:04', '2025-07-08 01:04:11', '2025-07-08 01:04:11'),
(308, 1, 'payment_charge', 'Withdraw approval charge', 1638.2, 245.73, 0, 'approved', '08-07-2025 07:04', '2025-07-08 01:04:18', '2025-07-08 01:04:18'),
(309, 1, 'payment_charge', 'Withdraw approval charge', 607.1, 91.07, 0, 'approved', '08-07-2025 07:04', '2025-07-08 01:04:24', '2025-07-08 01:04:24'),
(310, 1, 'payment_charge', 'Withdraw approval charge', 235, 35.25, 0, 'approved', '08-07-2025 07:04', '2025-07-08 01:04:30', '2025-07-08 01:04:30'),
(311, 1, 'payment_charge', 'Withdraw approval charge', 397, 59.55, 0, 'approved', '08-07-2025 07:04', '2025-07-08 01:04:37', '2025-07-08 01:04:37'),
(312, 1, 'payment_charge', 'Withdraw approval charge', 303, 45.45, 0, 'approved', '08-07-2025 07:04', '2025-07-08 01:04:42', '2025-07-08 01:04:42'),
(313, 1, 'payment_charge', 'Withdraw approval charge', 235, 35.25, 0, 'approved', '08-07-2025 07:04', '2025-07-08 01:04:48', '2025-07-08 01:04:48'),
(314, 1, 'payment_charge', 'Withdraw approval charge', 206, 30.9, 0, 'approved', '08-07-2025 07:04', '2025-07-08 01:04:54', '2025-07-08 01:04:54'),
(315, 1, 'payment_charge', 'Withdraw approval charge', 661, 99.15, 0, 'approved', '08-07-2025 07:05', '2025-07-08 01:05:00', '2025-07-08 01:05:00'),
(316, 1, 'payment_charge', 'Withdraw approval charge', 253, 37.95, 0, 'approved', '08-07-2025 07:05', '2025-07-08 01:05:06', '2025-07-08 01:05:06'),
(317, 1, 'payment_charge', 'Withdraw approval charge', 265, 39.75, 0, 'approved', '08-07-2025 07:05', '2025-07-08 01:05:15', '2025-07-08 01:05:15'),
(318, 1, 'payment_charge', 'Withdraw approval charge', 1538, 230.7, 0, 'approved', '08-07-2025 07:05', '2025-07-08 01:05:28', '2025-07-08 01:05:28'),
(319, 1, 'payment_charge', 'Withdraw approval charge', 227, 34.05, 0, 'approved', '08-07-2025 07:05', '2025-07-08 01:05:34', '2025-07-08 01:05:34'),
(320, 1, 'payment_charge', 'Withdraw approval charge', 233, 34.95, 0, 'approved', '08-07-2025 07:05', '2025-07-08 01:05:40', '2025-07-08 01:05:40'),
(321, 1, 'payment_charge', 'Withdraw approval charge', 722, 108.3, 0, 'approved', '08-07-2025 07:05', '2025-07-08 01:05:52', '2025-07-08 01:05:52'),
(322, 1, 'payment_charge', 'Withdraw approval charge', 420.3, 63.05, 0, 'approved', '08-07-2025 07:06', '2025-07-08 01:06:00', '2025-07-08 01:06:00'),
(323, 1, 'payment_charge', 'Withdraw approval charge', 1559, 233.85, 0, 'approved', '08-07-2025 07:06', '2025-07-08 01:06:11', '2025-07-08 01:06:11'),
(324, 1, 'payment_charge', 'Withdraw approval charge', 225, 33.75, 0, 'approved', '08-07-2025 07:06', '2025-07-08 01:06:17', '2025-07-08 01:06:17'),
(325, 1, 'payment_charge', 'Withdraw approval charge', 300, 45, 0, 'approved', '08-07-2025 07:06', '2025-07-08 01:06:27', '2025-07-08 01:06:27'),
(326, 1, 'payment_charge', 'Withdraw approval charge', 248.2, 37.23, 0, 'approved', '08-07-2025 07:06', '2025-07-08 01:06:35', '2025-07-08 01:06:35'),
(327, 1, 'payment_charge', 'Withdraw approval charge', 217.1, 32.57, 0, 'approved', '08-07-2025 07:06', '2025-07-08 01:06:47', '2025-07-08 01:06:47'),
(328, 1, 'payment_charge', 'Withdraw approval charge', 233, 34.95, 0, 'approved', '08-07-2025 07:06', '2025-07-08 01:06:55', '2025-07-08 01:06:55'),
(329, 1, 'payment_charge', 'Withdraw approval charge', 1065, 159.75, 0, 'approved', '08-07-2025 07:07', '2025-07-08 01:07:08', '2025-07-08 01:07:08'),
(330, 1, 'payment_charge', 'Withdraw approval charge', 240, 36, 0, 'approved', '08-07-2025 07:07', '2025-07-08 01:07:15', '2025-07-08 01:07:15'),
(331, 1, 'payment_charge', 'Withdraw approval charge', 239, 35.85, 0, 'approved', '08-07-2025 07:07', '2025-07-08 01:07:22', '2025-07-08 01:07:22'),
(332, 1, 'payment_charge', 'Withdraw approval charge', 8370, 1255.5, 0, 'approved', '08-07-2025 07:07', '2025-07-08 01:07:33', '2025-07-08 01:07:33'),
(333, 1, 'payment_charge', 'Withdraw approval charge', 290, 43.5, 0, 'approved', '08-07-2025 07:07', '2025-07-08 01:07:39', '2025-07-08 01:07:39'),
(334, 1, 'payment_charge', 'Withdraw approval charge', 300, 45, 0, 'approved', '08-07-2025 07:07', '2025-07-08 01:07:48', '2025-07-08 01:07:48'),
(335, 1, 'payment_charge', 'Withdraw approval charge', 336, 50.4, 0, 'approved', '08-07-2025 07:07', '2025-07-08 01:07:55', '2025-07-08 01:07:55'),
(336, 1, 'payment_charge', 'Withdraw approval charge', 215, 32.25, 0, 'approved', '08-07-2025 07:08', '2025-07-08 01:08:02', '2025-07-08 01:08:02'),
(337, 1, 'payment_charge', 'Withdraw approval charge', 1300, 195, 0, 'approved', '08-07-2025 07:08', '2025-07-08 01:08:14', '2025-07-08 01:08:14'),
(338, 1, 'payment_charge', 'Withdraw approval charge', 234.4, 35.16, 0, 'approved', '08-07-2025 07:08', '2025-07-08 01:08:21', '2025-07-08 01:08:21'),
(339, 1, 'payment_charge', 'Withdraw approval charge', 290, 43.5, 0, 'approved', '08-07-2025 07:08', '2025-07-08 01:08:27', '2025-07-08 01:08:27'),
(340, 1, 'payment_charge', 'Withdraw approval charge', 229, 34.35, 0, 'approved', '08-07-2025 07:08', '2025-07-08 01:08:33', '2025-07-08 01:08:33');
INSERT INTO `admin_ledgers` (`id`, `admin_id`, `reason`, `perticulation`, `amount`, `debit`, `credit`, `status`, `date`, `created_at`, `updated_at`) VALUES
(341, 1, 'payment_charge', 'Withdraw approval charge', 246, 36.9, 0, 'approved', '08-07-2025 07:08', '2025-07-08 01:08:40', '2025-07-08 01:08:40'),
(342, 1, 'payment_charge', 'Withdraw approval charge', 602, 90.3, 0, 'approved', '08-07-2025 07:08', '2025-07-08 01:08:49', '2025-07-08 01:08:49'),
(343, 1, 'payment_charge', 'Withdraw approval charge', 218.5, 32.78, 0, 'approved', '08-07-2025 07:08', '2025-07-08 01:08:55', '2025-07-08 01:08:55'),
(344, 1, 'payment_charge', 'Withdraw approval charge', 240, 36, 0, 'approved', '08-07-2025 07:09', '2025-07-08 01:09:01', '2025-07-08 01:09:01'),
(345, 1, 'payment_charge', 'Withdraw approval charge', 220, 33, 0, 'approved', '08-07-2025 07:09', '2025-07-08 01:09:10', '2025-07-08 01:09:10'),
(346, 1, 'payment_charge', 'Withdraw approval charge', 277.2, 41.58, 0, 'approved', '08-07-2025 07:09', '2025-07-08 01:09:16', '2025-07-08 01:09:16'),
(347, 1, 'payment_charge', 'Withdraw approval charge', 221, 33.15, 0, 'approved', '08-07-2025 07:09', '2025-07-08 01:09:22', '2025-07-08 01:09:22'),
(348, 1, 'payment_charge', 'Withdraw approval charge', 590, 88.5, 0, 'approved', '08-07-2025 07:09', '2025-07-08 01:09:29', '2025-07-08 01:09:29'),
(349, 1, 'payment_charge', 'Withdraw approval charge', 895, 134.25, 0, 'approved', '08-07-2025 07:09', '2025-07-08 01:09:35', '2025-07-08 01:09:35'),
(350, 1, 'payment_charge', 'Withdraw approval charge', 400, 60, 0, 'approved', '08-07-2025 07:09', '2025-07-08 01:09:42', '2025-07-08 01:09:42'),
(351, 1, 'payment_charge', 'Withdraw approval charge', 225, 33.75, 0, 'approved', '08-07-2025 07:09', '2025-07-08 01:09:48', '2025-07-08 01:09:48'),
(352, 1, 'payment_charge', 'Withdraw approval charge', 512.2, 76.83, 0, 'approved', '08-07-2025 07:09', '2025-07-08 01:09:55', '2025-07-08 01:09:55'),
(353, 1, 'payment_charge', 'Withdraw approval charge', 342.2, 51.33, 0, 'approved', '08-07-2025 07:10', '2025-07-08 01:10:02', '2025-07-08 01:10:02'),
(354, 1, 'payment_charge', 'Withdraw approval charge', 310, 46.5, 0, 'approved', '08-07-2025 07:10', '2025-07-08 01:10:09', '2025-07-08 01:10:09'),
(355, 1, 'payment_charge', 'Withdraw approval charge', 208, 31.2, 0, 'approved', '08-07-2025 07:10', '2025-07-08 01:10:20', '2025-07-08 01:10:20'),
(356, 1, 'payment_charge', 'Withdraw approval charge', 234, 35.1, 0, 'approved', '08-07-2025 07:10', '2025-07-08 01:10:25', '2025-07-08 01:10:25'),
(357, 1, 'payment_charge', 'Withdraw approval charge', 15146, 2271.9, 0, 'approved', '08-07-2025 07:10', '2025-07-08 01:10:32', '2025-07-08 01:10:32'),
(358, 1, 'payment_charge', 'Withdraw approval charge', 245, 36.75, 0, 'approved', '10-07-2025 10:51', '2025-07-10 04:51:51', '2025-07-10 04:51:51'),
(359, 1, 'payment_charge', 'Withdraw approval charge', 8036, 1205.4, 0, 'approved', '10-07-2025 10:51', '2025-07-10 04:51:57', '2025-07-10 04:51:57'),
(360, 1, 'payment_charge', 'Withdraw approval charge', 223, 33.45, 0, 'approved', '10-07-2025 10:52', '2025-07-10 04:52:02', '2025-07-10 04:52:02'),
(361, 1, 'payment_charge', 'Withdraw approval charge', 200, 30, 0, 'approved', '10-07-2025 10:52', '2025-07-10 04:52:09', '2025-07-10 04:52:09'),
(362, 1, 'payment_charge', 'Withdraw approval charge', 260, 39, 0, 'approved', '10-07-2025 10:52', '2025-07-10 04:52:16', '2025-07-10 04:52:16'),
(363, 1, 'payment_charge', 'Withdraw approval charge', 300, 45, 0, 'approved', '10-07-2025 10:52', '2025-07-10 04:52:23', '2025-07-10 04:52:23'),
(364, 1, 'payment_charge', 'Withdraw approval charge', 364, 54.6, 0, 'approved', '10-07-2025 10:52', '2025-07-10 04:52:29', '2025-07-10 04:52:29'),
(365, 1, 'payment_charge', 'Withdraw approval charge', 610, 91.5, 0, 'approved', '10-07-2025 10:52', '2025-07-10 04:52:36', '2025-07-10 04:52:36'),
(366, 1, 'payment_charge', 'Withdraw approval charge', 208, 31.2, 0, 'approved', '10-07-2025 10:52', '2025-07-10 04:52:49', '2025-07-10 04:52:49'),
(367, 1, 'payment_charge', 'Withdraw approval charge', 3020, 453, 0, 'approved', '10-07-2025 10:52', '2025-07-10 04:52:58', '2025-07-10 04:52:58'),
(368, 1, 'payment_charge', 'Withdraw approval charge', 223, 33.45, 0, 'approved', '10-07-2025 10:53', '2025-07-10 04:53:05', '2025-07-10 04:53:05'),
(369, 1, 'payment_charge', 'Withdraw approval charge', 3020, 453, 0, 'approved', '10-07-2025 10:53', '2025-07-10 04:53:13', '2025-07-10 04:53:13'),
(370, 1, 'payment_charge', 'Withdraw approval charge', 217, 32.55, 0, 'approved', '10-07-2025 10:53', '2025-07-10 04:53:20', '2025-07-10 04:53:20'),
(371, 1, 'payment_charge', 'Withdraw approval charge', 1520, 228, 0, 'approved', '10-07-2025 10:53', '2025-07-10 04:53:28', '2025-07-10 04:53:28'),
(372, 1, 'payment_charge', 'Withdraw approval charge', 1612, 241.8, 0, 'approved', '10-07-2025 10:53', '2025-07-10 04:53:35', '2025-07-10 04:53:35'),
(373, 1, 'payment_charge', 'Withdraw approval charge', 200, 30, 0, 'approved', '10-07-2025 10:53', '2025-07-10 04:53:42', '2025-07-10 04:53:42'),
(374, 1, 'payment_charge', 'Withdraw approval charge', 2500, 375, 0, 'approved', '10-07-2025 10:53', '2025-07-10 04:53:48', '2025-07-10 04:53:48'),
(375, 1, 'payment_charge', 'Withdraw approval charge', 1180, 177, 0, 'approved', '10-07-2025 10:53', '2025-07-10 04:53:54', '2025-07-10 04:53:54'),
(376, 1, 'payment_charge', 'Withdraw approval charge', 230, 34.5, 0, 'approved', '10-07-2025 10:53', '2025-07-10 04:53:59', '2025-07-10 04:53:59'),
(377, 1, 'payment_charge', 'Withdraw approval charge', 291, 43.65, 0, 'approved', '10-07-2025 10:54', '2025-07-10 04:54:05', '2025-07-10 04:54:05'),
(378, 1, 'payment_charge', 'Withdraw approval charge', 579, 86.85, 0, 'approved', '10-07-2025 10:54', '2025-07-10 04:54:11', '2025-07-10 04:54:11'),
(379, 1, 'payment_charge', 'Withdraw approval charge', 216.1, 32.42, 0, 'approved', '10-07-2025 10:54', '2025-07-10 04:54:17', '2025-07-10 04:54:17'),
(380, 1, 'payment_charge', 'Withdraw approval charge', 665, 99.75, 0, 'approved', '10-07-2025 10:54', '2025-07-10 04:54:23', '2025-07-10 04:54:23'),
(381, 1, 'payment_charge', 'Withdraw approval charge', 1548, 232.2, 0, 'approved', '10-07-2025 10:54', '2025-07-10 04:54:29', '2025-07-10 04:54:29'),
(382, 1, 'payment_charge', 'Withdraw approval charge', 220, 33, 0, 'approved', '10-07-2025 10:54', '2025-07-10 04:54:36', '2025-07-10 04:54:36'),
(383, 1, 'payment_charge', 'Withdraw approval charge', 222, 33.3, 0, 'approved', '10-07-2025 10:54', '2025-07-10 04:54:48', '2025-07-10 04:54:48'),
(384, 1, 'payment_charge', 'Withdraw approval charge', 220, 33, 0, 'approved', '10-07-2025 10:55', '2025-07-10 04:55:03', '2025-07-10 04:55:03'),
(385, 1, 'payment_charge', 'Withdraw approval charge', 1510, 226.5, 0, 'approved', '10-07-2025 10:55', '2025-07-10 04:55:16', '2025-07-10 04:55:16'),
(386, 1, 'payment_charge', 'Withdraw approval charge', 237, 35.55, 0, 'approved', '10-07-2025 10:55', '2025-07-10 04:55:23', '2025-07-10 04:55:23'),
(387, 1, 'payment_charge', 'Withdraw approval charge', 290, 43.5, 0, 'approved', '10-07-2025 10:55', '2025-07-10 04:55:29', '2025-07-10 04:55:29'),
(388, 1, 'payment_charge', 'Withdraw approval charge', 1615, 242.25, 0, 'approved', '10-07-2025 10:55', '2025-07-10 04:55:39', '2025-07-10 04:55:39'),
(389, 1, 'payment_charge', 'Withdraw approval charge', 224, 33.6, 0, 'approved', '10-07-2025 10:55', '2025-07-10 04:55:46', '2025-07-10 04:55:46'),
(390, 1, 'payment_charge', 'Withdraw approval charge', 1510, 226.5, 0, 'approved', '10-07-2025 10:55', '2025-07-10 04:55:57', '2025-07-10 04:55:57'),
(391, 1, 'payment_charge', 'Withdraw approval charge', 220, 33, 0, 'approved', '10-07-2025 10:56', '2025-07-10 04:56:13', '2025-07-10 04:56:13'),
(392, 1, 'payment_charge', 'Withdraw approval charge', 240, 36, 0, 'approved', '10-07-2025 10:56', '2025-07-10 04:56:21', '2025-07-10 04:56:21'),
(393, 1, 'payment_charge', 'Withdraw approval charge', 617, 92.55, 0, 'approved', '10-07-2025 10:56', '2025-07-10 04:56:26', '2025-07-10 04:56:26'),
(394, 1, 'payment_charge', 'Withdraw approval charge', 234, 35.1, 0, 'approved', '10-07-2025 10:56', '2025-07-10 04:56:32', '2025-07-10 04:56:32'),
(395, 1, 'payment_charge', 'Withdraw approval charge', 819, 122.85, 0, 'approved', '10-07-2025 10:56', '2025-07-10 04:56:40', '2025-07-10 04:56:40'),
(396, 1, 'payment_charge', 'Withdraw approval charge', 600, 90, 0, 'approved', '10-07-2025 10:56', '2025-07-10 04:56:56', '2025-07-10 04:56:56'),
(397, 1, 'payment_charge', 'Withdraw approval charge', 217, 32.55, 0, 'approved', '10-07-2025 10:57', '2025-07-10 04:57:04', '2025-07-10 04:57:04'),
(398, 1, 'payment_charge', 'Withdraw approval charge', 220, 33, 0, 'approved', '10-07-2025 10:57', '2025-07-10 04:57:10', '2025-07-10 04:57:10'),
(399, 1, 'payment_charge', 'Withdraw approval charge', 504, 75.6, 0, 'approved', '10-07-2025 10:57', '2025-07-10 04:57:15', '2025-07-10 04:57:15'),
(400, 1, 'payment_charge', 'Withdraw approval charge', 590, 88.5, 0, 'approved', '10-07-2025 10:57', '2025-07-10 04:57:21', '2025-07-10 04:57:21'),
(401, 1, 'payment_charge', 'Withdraw approval charge', 236, 35.4, 0, 'approved', '10-07-2025 10:57', '2025-07-10 04:57:26', '2025-07-10 04:57:26'),
(402, 1, 'payment_charge', 'Withdraw approval charge', 233, 34.95, 0, 'approved', '10-07-2025 10:57', '2025-07-10 04:57:32', '2025-07-10 04:57:32'),
(403, 1, 'payment_charge', 'Withdraw approval charge', 3000, 450, 0, 'approved', '10-07-2025 10:57', '2025-07-10 04:57:36', '2025-07-10 04:57:36'),
(404, 1, 'payment_charge', 'Withdraw approval charge', 1510, 226.5, 0, 'approved', '10-07-2025 10:57', '2025-07-10 04:57:42', '2025-07-10 04:57:42'),
(405, 1, 'payment_charge', 'Withdraw approval charge', 3044, 456.6, 0, 'approved', '10-07-2025 10:57', '2025-07-10 04:57:47', '2025-07-10 04:57:47'),
(406, 1, 'payment_charge', 'Withdraw approval charge', 2660.2, 399.03, 0, 'approved', '10-07-2025 10:57', '2025-07-10 04:57:53', '2025-07-10 04:57:53'),
(407, 1, 'payment_charge', 'Withdraw approval charge', 2110, 316.5, 0, 'approved', '10-07-2025 10:57', '2025-07-10 04:57:58', '2025-07-10 04:57:58'),
(408, 1, 'payment_charge', 'Withdraw approval charge', 2110, 316.5, 0, 'approved', '10-07-2025 10:57', '2025-07-10 04:57:59', '2025-07-10 04:57:59'),
(409, 1, 'payment_charge', 'Withdraw approval charge', 400, 60, 0, 'approved', '10-07-2025 10:58', '2025-07-10 04:58:03', '2025-07-10 04:58:03'),
(410, 1, 'payment_charge', 'Withdraw approval charge', 5540, 831, 0, 'approved', '10-07-2025 10:58', '2025-07-10 04:58:08', '2025-07-10 04:58:08'),
(411, 1, 'payment_charge', 'Withdraw approval charge', 310, 46.5, 0, 'approved', '10-07-2025 10:58', '2025-07-10 04:58:13', '2025-07-10 04:58:13'),
(412, 1, 'payment_charge', 'Withdraw approval charge', 1656, 248.4, 0, 'approved', '10-07-2025 10:58', '2025-07-10 04:58:19', '2025-07-10 04:58:19'),
(413, 1, 'payment_charge', 'Withdraw approval charge', 622, 93.3, 0, 'approved', '10-07-2025 10:58', '2025-07-10 04:58:25', '2025-07-10 04:58:25'),
(414, 1, 'payment_charge', 'Withdraw approval charge', 1516, 227.4, 0, 'approved', '10-07-2025 10:58', '2025-07-10 04:58:30', '2025-07-10 04:58:30'),
(415, 1, 'payment_charge', 'Withdraw approval charge', 288, 43.2, 0, 'approved', '10-07-2025 10:58', '2025-07-10 04:58:37', '2025-07-10 04:58:37'),
(416, 1, 'payment_charge', 'Withdraw approval charge', 622, 93.3, 0, 'approved', '10-07-2025 10:58', '2025-07-10 04:58:43', '2025-07-10 04:58:43'),
(417, 1, 'payment_charge', 'Withdraw approval charge', 2455, 368.25, 0, 'approved', '10-07-2025 10:58', '2025-07-10 04:58:48', '2025-07-10 04:58:48'),
(418, 1, 'payment_charge', 'Withdraw approval charge', 251, 37.65, 0, 'approved', '10-07-2025 10:58', '2025-07-10 04:58:54', '2025-07-10 04:58:54'),
(419, 1, 'payment_charge', 'Withdraw approval charge', 940, 141, 0, 'approved', '10-07-2025 10:58', '2025-07-10 04:58:59', '2025-07-10 04:58:59'),
(420, 1, 'payment_charge', 'Withdraw approval charge', 3140, 471, 0, 'approved', '10-07-2025 10:59', '2025-07-10 04:59:09', '2025-07-10 04:59:09'),
(421, 1, 'payment_charge', 'Withdraw approval charge', 204, 30.6, 0, 'approved', '10-07-2025 10:59', '2025-07-10 04:59:14', '2025-07-10 04:59:14'),
(422, 1, 'payment_charge', 'Withdraw approval charge', 291, 43.65, 0, 'approved', '10-07-2025 10:59', '2025-07-10 04:59:20', '2025-07-10 04:59:20'),
(423, 1, 'payment_charge', 'Withdraw approval charge', 3146, 471.9, 0, 'approved', '10-07-2025 10:59', '2025-07-10 04:59:25', '2025-07-10 04:59:25'),
(424, 1, 'payment_charge', 'Withdraw approval charge', 1632, 244.8, 0, 'approved', '10-07-2025 10:59', '2025-07-10 04:59:30', '2025-07-10 04:59:30'),
(425, 1, 'payment_charge', 'Withdraw approval charge', 4000, 600, 0, 'approved', '10-07-2025 10:59', '2025-07-10 04:59:35', '2025-07-10 04:59:35'),
(426, 1, 'payment_charge', 'Withdraw approval charge', 1535, 230.25, 0, 'approved', '10-07-2025 10:59', '2025-07-10 04:59:40', '2025-07-10 04:59:40'),
(427, 1, 'payment_charge', 'Withdraw approval charge', 1098, 164.7, 0, 'approved', '10-07-2025 10:59', '2025-07-10 04:59:46', '2025-07-10 04:59:46'),
(428, 1, 'payment_charge', 'Withdraw approval charge', 1123, 168.45, 0, 'approved', '10-07-2025 10:59', '2025-07-10 04:59:50', '2025-07-10 04:59:50'),
(429, 1, 'payment_charge', 'Withdraw approval charge', 1546, 231.9, 0, 'approved', '10-07-2025 10:59', '2025-07-10 04:59:54', '2025-07-10 04:59:54'),
(430, 1, 'payment_charge', 'Withdraw approval charge', 379, 56.85, 0, 'approved', '10-07-2025 11:00', '2025-07-10 05:00:00', '2025-07-10 05:00:00'),
(431, 1, 'payment_charge', 'Withdraw approval charge', 1526, 228.9, 0, 'approved', '10-07-2025 11:00', '2025-07-10 05:00:06', '2025-07-10 05:00:06'),
(432, 1, 'payment_charge', 'Withdraw approval charge', 238, 35.7, 0, 'approved', '10-07-2025 11:00', '2025-07-10 05:00:16', '2025-07-10 05:00:16'),
(433, 1, 'payment_charge', 'Withdraw approval charge', 486.2, 72.93, 0, 'approved', '10-07-2025 11:00', '2025-07-10 05:00:21', '2025-07-10 05:00:21'),
(434, 1, 'payment_charge', 'Withdraw approval charge', 255, 38.25, 0, 'approved', '10-07-2025 11:00', '2025-07-10 05:00:34', '2025-07-10 05:00:34'),
(435, 1, 'payment_charge', 'Withdraw approval charge', 450, 67.5, 0, 'approved', '10-07-2025 11:00', '2025-07-10 05:00:39', '2025-07-10 05:00:39'),
(436, 1, 'payment_charge', 'Withdraw approval charge', 305, 45.75, 0, 'approved', '10-07-2025 11:00', '2025-07-10 05:00:44', '2025-07-10 05:00:44'),
(437, 1, 'payment_charge', 'Withdraw approval charge', 200, 30, 0, 'approved', '10-07-2025 11:00', '2025-07-10 05:00:49', '2025-07-10 05:00:49'),
(438, 1, 'payment_charge', 'Withdraw approval charge', 910, 136.5, 0, 'approved', '10-07-2025 11:01', '2025-07-10 05:01:03', '2025-07-10 05:01:03'),
(439, 1, 'payment_charge', 'Withdraw approval charge', 1527, 229.05, 0, 'approved', '10-07-2025 11:01', '2025-07-10 05:01:09', '2025-07-10 05:01:09'),
(440, 1, 'payment_charge', 'Withdraw approval charge', 2810, 421.5, 0, 'approved', '10-07-2025 11:01', '2025-07-10 05:01:13', '2025-07-10 05:01:13'),
(441, 1, 'payment_charge', 'Withdraw approval charge', 244, 36.6, 0, 'approved', '10-07-2025 11:01', '2025-07-10 05:01:19', '2025-07-10 05:01:19'),
(442, 1, 'payment_charge', 'Withdraw approval charge', 3444, 516.6, 0, 'approved', '10-07-2025 11:01', '2025-07-10 05:01:23', '2025-07-10 05:01:23'),
(443, 1, 'payment_charge', 'Withdraw approval charge', 576, 86.4, 0, 'approved', '10-07-2025 11:01', '2025-07-10 05:01:29', '2025-07-10 05:01:29'),
(444, 1, 'payment_charge', 'Withdraw approval charge', 273, 40.95, 0, 'approved', '10-07-2025 11:01', '2025-07-10 05:01:34', '2025-07-10 05:01:34'),
(445, 1, 'payment_charge', 'Withdraw approval charge', 263, 39.45, 0, 'approved', '10-07-2025 11:01', '2025-07-10 05:01:39', '2025-07-10 05:01:39'),
(446, 1, 'payment_charge', 'Withdraw approval charge', 474, 71.1, 0, 'approved', '10-07-2025 11:01', '2025-07-10 05:01:46', '2025-07-10 05:01:46'),
(447, 1, 'payment_charge', 'Withdraw approval charge', 239, 35.85, 0, 'approved', '10-07-2025 11:01', '2025-07-10 05:01:50', '2025-07-10 05:01:50'),
(448, 1, 'payment_charge', 'Withdraw approval charge', 220.1, 33.02, 0, 'approved', '10-07-2025 11:01', '2025-07-10 05:01:56', '2025-07-10 05:01:56'),
(449, 1, 'payment_charge', 'Withdraw approval charge', 326, 48.9, 0, 'approved', '10-07-2025 11:02', '2025-07-10 05:02:00', '2025-07-10 05:02:00'),
(450, 1, 'payment_charge', 'Withdraw approval charge', 213, 31.95, 0, 'approved', '10-07-2025 11:02', '2025-07-10 05:02:11', '2025-07-10 05:02:11'),
(451, 1, 'payment_charge', 'Withdraw approval charge', 8148, 1222.2, 0, 'approved', '10-07-2025 11:02', '2025-07-10 05:02:17', '2025-07-10 05:02:17'),
(452, 1, 'payment_charge', 'Withdraw approval charge', 337, 50.55, 0, 'approved', '10-07-2025 11:02', '2025-07-10 05:02:21', '2025-07-10 05:02:21'),
(453, 1, 'payment_charge', 'Withdraw approval charge', 1559, 233.85, 0, 'approved', '10-07-2025 11:02', '2025-07-10 05:02:26', '2025-07-10 05:02:26'),
(454, 1, 'payment_charge', 'Withdraw approval charge', 5000, 750, 0, 'approved', '10-07-2025 11:02', '2025-07-10 05:02:30', '2025-07-10 05:02:30'),
(455, 1, 'payment_charge', 'Withdraw approval charge', 660, 99, 0, 'approved', '10-07-2025 11:02', '2025-07-10 05:02:34', '2025-07-10 05:02:34'),
(456, 1, 'payment_charge', 'Withdraw approval charge', 290, 43.5, 0, 'approved', '10-07-2025 11:02', '2025-07-10 05:02:39', '2025-07-10 05:02:39'),
(457, 1, 'payment_charge', 'Withdraw approval charge', 202, 30.3, 0, 'approved', '10-07-2025 11:02', '2025-07-10 05:02:44', '2025-07-10 05:02:44'),
(458, 1, 'payment_charge', 'Withdraw approval charge', 241, 36.15, 0, 'approved', '10-07-2025 11:02', '2025-07-10 05:02:48', '2025-07-10 05:02:48'),
(459, 1, 'payment_charge', 'Withdraw approval charge', 220, 33, 0, 'approved', '10-07-2025 11:02', '2025-07-10 05:02:52', '2025-07-10 05:02:52'),
(460, 1, 'payment_charge', 'Withdraw approval charge', 200, 30, 0, 'approved', '10-07-2025 11:02', '2025-07-10 05:02:57', '2025-07-10 05:02:57'),
(461, 1, 'payment_charge', 'Withdraw approval charge', 881, 132.15, 0, 'approved', '10-07-2025 11:03', '2025-07-10 05:03:02', '2025-07-10 05:03:02'),
(462, 1, 'payment_charge', 'Withdraw approval charge', 217, 32.55, 0, 'approved', '10-07-2025 11:03', '2025-07-10 05:03:07', '2025-07-10 05:03:07'),
(463, 1, 'payment_charge', 'Withdraw approval charge', 214.3, 32.15, 0, 'approved', '10-07-2025 11:03', '2025-07-10 05:03:12', '2025-07-10 05:03:12'),
(464, 1, 'payment_charge', 'Withdraw approval charge', 290, 43.5, 0, 'approved', '10-07-2025 11:03', '2025-07-10 05:03:16', '2025-07-10 05:03:16'),
(465, 1, 'payment_charge', 'Withdraw approval charge', 225, 33.75, 0, 'approved', '10-07-2025 11:03', '2025-07-10 05:03:21', '2025-07-10 05:03:21'),
(466, 1, 'payment_charge', 'Withdraw approval charge', 4145, 621.75, 0, 'approved', '10-07-2025 11:03', '2025-07-10 05:03:25', '2025-07-10 05:03:25'),
(467, 1, 'payment_charge', 'Withdraw approval charge', 1670, 250.5, 0, 'approved', '10-07-2025 11:03', '2025-07-10 05:03:30', '2025-07-10 05:03:30'),
(468, 1, 'payment_charge', 'Withdraw approval charge', 212, 31.8, 0, 'approved', '10-07-2025 11:03', '2025-07-10 05:03:35', '2025-07-10 05:03:35'),
(469, 1, 'payment_charge', 'Withdraw approval charge', 1659, 248.85, 0, 'approved', '10-07-2025 11:03', '2025-07-10 05:03:39', '2025-07-10 05:03:39'),
(470, 1, 'payment_charge', 'Withdraw approval charge', 340, 51, 0, 'approved', '10-07-2025 11:03', '2025-07-10 05:03:44', '2025-07-10 05:03:44'),
(471, 1, 'payment_charge', 'Withdraw approval charge', 208, 31.2, 0, 'approved', '10-07-2025 11:03', '2025-07-10 05:03:50', '2025-07-10 05:03:50'),
(472, 1, 'payment_charge', 'Withdraw approval charge', 8000, 1200, 0, 'approved', '10-07-2025 11:03', '2025-07-10 05:03:55', '2025-07-10 05:03:55'),
(473, 1, 'payment_charge', 'Withdraw approval charge', 246, 36.9, 0, 'approved', '10-07-2025 11:04', '2025-07-10 05:04:00', '2025-07-10 05:04:00'),
(474, 1, 'payment_charge', 'Withdraw approval charge', 3692, 553.8, 0, 'approved', '10-07-2025 11:04', '2025-07-10 05:04:04', '2025-07-10 05:04:04'),
(475, 1, 'payment_charge', 'Withdraw approval charge', 5819, 872.85, 0, 'approved', '10-07-2025 11:04', '2025-07-10 05:04:10', '2025-07-10 05:04:10'),
(476, 1, 'payment_charge', 'Withdraw approval charge', 222, 33.3, 0, 'approved', '10-07-2025 11:04', '2025-07-10 05:04:15', '2025-07-10 05:04:15'),
(477, 1, 'payment_charge', 'Withdraw approval charge', 220, 33, 0, 'approved', '10-07-2025 11:04', '2025-07-10 05:04:22', '2025-07-10 05:04:22'),
(478, 1, 'payment_charge', 'Withdraw approval charge', 261, 39.15, 0, 'approved', '10-07-2025 11:04', '2025-07-10 05:04:26', '2025-07-10 05:04:26'),
(479, 1, 'payment_charge', 'Withdraw approval charge', 206, 30.9, 0, 'approved', '10-07-2025 11:04', '2025-07-10 05:04:30', '2025-07-10 05:04:30'),
(480, 1, 'payment_charge', 'Withdraw approval charge', 229, 34.35, 0, 'approved', '10-07-2025 11:04', '2025-07-10 05:04:36', '2025-07-10 05:04:36'),
(481, 1, 'payment_charge', 'Withdraw approval charge', 210, 31.5, 0, 'approved', '10-07-2025 11:04', '2025-07-10 05:04:40', '2025-07-10 05:04:40'),
(482, 1, 'payment_charge', 'Withdraw approval charge', 409, 61.35, 0, 'approved', '10-07-2025 11:04', '2025-07-10 05:04:45', '2025-07-10 05:04:45'),
(483, 1, 'payment_charge', 'Withdraw approval charge', 200, 30, 0, 'approved', '10-07-2025 11:04', '2025-07-10 05:04:49', '2025-07-10 05:04:49'),
(484, 1, 'payment_charge', 'Withdraw approval charge', 2466, 369.9, 0, 'approved', '10-07-2025 11:04', '2025-07-10 05:04:54', '2025-07-10 05:04:54'),
(485, 1, 'payment_charge', 'Withdraw approval charge', 3042, 456.3, 0, 'approved', '10-07-2025 11:05', '2025-07-10 05:05:00', '2025-07-10 05:05:00'),
(486, 1, 'payment_charge', 'Withdraw approval charge', 500, 75, 0, 'approved', '10-07-2025 11:05', '2025-07-10 05:05:10', '2025-07-10 05:05:10'),
(487, 1, 'payment_charge', 'Withdraw approval charge', 1794, 89.7, 0, 'approved', '31-07-2025 22:41', '2025-07-31 22:41:18', '2025-07-31 22:41:18'),
(488, 1, 'payment_charge', 'Withdraw approval charge', 2100, 105, 0, 'approved', '31-07-2025 22:48', '2025-07-31 22:48:20', '2025-07-31 22:48:20'),
(489, 1, 'payment_charge', 'Withdraw approval charge', 2000, 100, 0, 'approved', '31-07-2025 22:52', '2025-07-31 22:52:15', '2025-07-31 22:52:15'),
(490, 1, 'payment_charge', 'Withdraw approval charge', 2105, 105.25, 0, 'approved', '31-07-2025 22:58', '2025-07-31 22:58:08', '2025-07-31 22:58:08'),
(491, 1, 'payment_charge', 'Withdraw approval charge', 1600, 80, 0, 'approved', '01-08-2025 10:05', '2025-08-01 10:05:16', '2025-08-01 10:05:16'),
(492, 1, 'payment_charge', 'Withdraw approval charge', 1600, 80, 0, 'approved', '01-08-2025 10:06', '2025-08-01 10:06:31', '2025-08-01 10:06:31'),
(493, 1, 'payment_charge', 'Withdraw approval charge', 1600, 80, 0, 'approved', '01-08-2025 10:06', '2025-08-01 10:06:31', '2025-08-01 10:06:31'),
(494, 1, 'payment_charge', 'Withdraw approval charge', 1209, 60.45, 0, 'approved', '01-08-2025 10:07', '2025-08-01 10:07:28', '2025-08-01 10:07:28'),
(495, 1, 'payment_charge', 'Withdraw approval charge', 1010, 50.5, 0, 'approved', '01-08-2025 10:08', '2025-08-01 10:08:54', '2025-08-01 10:08:54'),
(496, 1, 'payment_charge', 'Withdraw approval charge', 4947, 247.35, 0, 'approved', '01-08-2025 10:17', '2025-08-01 10:17:06', '2025-08-01 10:17:06'),
(497, 1, 'payment_charge', 'Withdraw approval charge', 505, 25.25, 0, 'approved', '01-08-2025 12:19', '2025-08-01 12:19:06', '2025-08-01 12:19:06'),
(498, 1, 'payment_charge', 'Withdraw approval charge', 396, 19.8, 0, 'approved', '01-08-2025 14:55', '2025-08-01 14:55:01', '2025-08-01 14:55:01'),
(499, 1, 'payment_charge', 'Withdraw approval charge', 478, 23.9, 0, 'approved', '01-08-2025 15:52', '2025-08-01 15:52:38', '2025-08-01 15:52:38'),
(500, 1, 'payment_charge', 'Withdraw approval charge', 215, 10.75, 0, 'approved', '01-08-2025 16:19', '2025-08-01 16:19:20', '2025-08-01 16:19:20'),
(501, 1, 'payment_charge', 'Withdraw approval charge', 600, 30, 0, 'approved', '01-08-2025 16:20', '2025-08-01 16:20:18', '2025-08-01 16:20:18'),
(502, 1, 'payment_charge', 'Withdraw approval charge', 153, 7.65, 0, 'approved', '01-08-2025 16:21', '2025-08-01 16:21:37', '2025-08-01 16:21:37'),
(503, 1, 'payment_charge', 'Withdraw approval charge', 392, 19.6, 0, 'approved', '01-08-2025 16:22', '2025-08-01 16:22:05', '2025-08-01 16:22:05'),
(504, 1, 'payment_charge', 'Withdraw approval charge', 216, 10.8, 0, 'approved', '01-08-2025 16:46', '2025-08-01 16:46:43', '2025-08-01 16:46:43'),
(505, 1, 'payment_charge', 'Withdraw approval charge', 210, 10.5, 0, 'approved', '01-08-2025 16:52', '2025-08-01 16:52:55', '2025-08-01 16:52:55'),
(506, 1, 'payment_charge', 'Withdraw approval charge', 160, 8, 0, 'approved', '01-08-2025 18:26', '2025-08-01 18:26:37', '2025-08-01 18:26:37'),
(507, 1, 'payment_charge', 'Withdraw approval charge', 151, 7.55, 0, 'approved', '01-08-2025 18:27', '2025-08-01 18:27:26', '2025-08-01 18:27:26'),
(508, 1, 'payment_charge', 'Withdraw approval charge', 213, 10.65, 0, 'approved', '01-08-2025 19:41', '2025-08-01 19:41:33', '2025-08-01 19:41:33'),
(509, 1, 'payment_charge', 'Withdraw approval charge', 213, 10.65, 0, 'approved', '01-08-2025 19:42', '2025-08-01 19:42:58', '2025-08-01 19:42:58'),
(510, 1, 'payment_charge', 'Withdraw approval charge', 218, 10.9, 0, 'approved', '01-08-2025 21:08', '2025-08-01 21:08:16', '2025-08-01 21:08:16'),
(511, 1, 'payment_charge', 'Withdraw approval charge', 309, 15.45, 0, 'approved', '01-08-2025 21:38', '2025-08-01 21:38:30', '2025-08-01 21:38:30'),
(512, 1, 'payment_charge', 'Withdraw approval charge', 207, 10.35, 0, 'approved', '01-08-2025 21:57', '2025-08-01 21:57:29', '2025-08-01 21:57:29'),
(513, 1, 'payment_charge', 'Withdraw approval charge', 210, 10.5, 0, 'approved', '01-08-2025 22:21', '2025-08-01 22:21:58', '2025-08-01 22:21:58'),
(514, 1, 'payment_charge', 'Withdraw approval charge', 170, 8.5, 0, 'approved', '01-08-2025 22:23', '2025-08-01 22:23:58', '2025-08-01 22:23:58'),
(515, 1, 'payment_charge', 'Withdraw approval charge', 318, 15.9, 0, 'approved', '01-08-2025 22:35', '2025-08-01 22:35:52', '2025-08-01 22:35:52'),
(516, 1, 'payment_charge', 'Withdraw approval charge', 323, 16.15, 0, 'approved', '01-08-2025 22:46', '2025-08-01 22:46:54', '2025-08-01 22:46:54'),
(517, 1, 'payment_charge', 'Withdraw approval charge', 210, 10.5, 0, 'approved', '01-08-2025 22:47', '2025-08-01 22:47:44', '2025-08-01 22:47:44'),
(518, 1, 'payment_charge', 'Withdraw approval charge', 215, 10.75, 0, 'approved', '01-08-2025 22:48', '2025-08-01 22:48:16', '2025-08-01 22:48:16'),
(519, 1, 'payment_charge', 'Withdraw approval charge', 404, 20.2, 0, 'approved', '02-08-2025 10:02', '2025-08-02 10:02:15', '2025-08-02 10:02:15'),
(520, 1, 'payment_charge', 'Withdraw approval charge', 165, 8.25, 0, 'approved', '02-08-2025 10:05', '2025-08-02 10:05:13', '2025-08-02 10:05:13'),
(521, 1, 'payment_charge', 'Withdraw approval charge', 294, 14.7, 0, 'approved', '02-08-2025 10:07', '2025-08-02 10:07:28', '2025-08-02 10:07:28'),
(522, 1, 'payment_charge', 'Withdraw approval charge', 215, 10.75, 0, 'approved', '02-08-2025 10:10', '2025-08-02 10:10:41', '2025-08-02 10:10:41'),
(523, 1, 'payment_charge', 'Withdraw approval charge', 170, 8.5, 0, 'approved', '02-08-2025 10:28', '2025-08-02 10:28:05', '2025-08-02 10:28:05'),
(524, 1, 'payment_charge', 'Withdraw approval charge', 170, 8.5, 0, 'approved', '02-08-2025 10:30', '2025-08-02 10:30:41', '2025-08-02 10:30:41'),
(525, 1, 'payment_charge', 'Withdraw approval charge', 224, 11.2, 0, 'approved', '02-08-2025 10:35', '2025-08-02 10:35:53', '2025-08-02 10:35:53'),
(526, 1, 'payment_charge', 'Withdraw approval charge', 376, 18.8, 0, 'approved', '02-08-2025 10:38', '2025-08-02 10:38:33', '2025-08-02 10:38:33'),
(527, 1, 'payment_charge', 'Withdraw approval charge', 155, 7.75, 0, 'approved', '02-08-2025 10:48', '2025-08-02 10:48:52', '2025-08-02 10:48:52'),
(528, 1, 'payment_charge', 'Withdraw approval charge', 352, 17.6, 0, 'approved', '02-08-2025 10:49', '2025-08-02 10:49:31', '2025-08-02 10:49:31'),
(529, 1, 'payment_charge', 'Withdraw approval charge', 200, 10, 0, 'approved', '02-08-2025 11:07', '2025-08-02 11:07:32', '2025-08-02 11:07:32'),
(530, 1, 'payment_charge', 'Withdraw approval charge', 170, 8.5, 0, 'approved', '02-08-2025 11:36', '2025-08-02 11:36:47', '2025-08-02 11:36:47'),
(531, 1, 'payment_charge', 'Withdraw approval charge', 180, 9, 0, 'approved', '02-08-2025 11:45', '2025-08-02 11:45:19', '2025-08-02 11:45:19'),
(532, 1, 'payment_charge', 'Withdraw approval charge', 299, 14.95, 0, 'approved', '02-08-2025 11:46', '2025-08-02 11:46:43', '2025-08-02 11:46:43'),
(533, 1, 'payment_charge', 'Withdraw approval charge', 407, 20.35, 0, 'approved', '02-08-2025 11:49', '2025-08-02 11:49:00', '2025-08-02 11:49:00'),
(534, 1, 'payment_charge', 'Withdraw approval charge', 200, 10, 0, 'approved', '02-08-2025 12:02', '2025-08-02 12:02:27', '2025-08-02 12:02:27'),
(535, 1, 'payment_charge', 'Withdraw approval charge', 212, 10.6, 0, 'approved', '02-08-2025 12:21', '2025-08-02 12:21:33', '2025-08-02 12:21:33'),
(536, 1, 'payment_charge', 'Withdraw approval charge', 175, 8.75, 0, 'approved', '02-08-2025 12:30', '2025-08-02 12:30:29', '2025-08-02 12:30:29'),
(537, 1, 'payment_charge', 'Withdraw approval charge', 2100, 105, 0, 'approved', '02-08-2025 12:48', '2025-08-02 12:48:16', '2025-08-02 12:48:16'),
(538, 1, 'payment_charge', 'Withdraw approval charge', 200, 10, 0, 'approved', '02-08-2025 13:25', '2025-08-02 13:25:16', '2025-08-02 13:25:16'),
(539, 1, 'payment_charge', 'Withdraw approval charge', 150, 7.5, 0, 'approved', '02-08-2025 13:49', '2025-08-02 13:49:39', '2025-08-02 13:49:39'),
(540, 1, 'payment_charge', 'Withdraw approval charge', 366, 18.3, 0, 'approved', '02-08-2025 13:50', '2025-08-02 13:50:26', '2025-08-02 13:50:26'),
(541, 1, 'payment_charge', 'Withdraw approval charge', 315, 15.75, 0, 'approved', '02-08-2025 14:28', '2025-08-02 14:28:07', '2025-08-02 14:28:07'),
(542, 1, 'payment_charge', 'Withdraw approval charge', 216, 10.8, 0, 'approved', '02-08-2025 15:11', '2025-08-02 15:11:00', '2025-08-02 15:11:00'),
(543, 1, 'payment_charge', 'Withdraw approval charge', 165, 8.25, 0, 'approved', '02-08-2025 15:12', '2025-08-02 15:12:28', '2025-08-02 15:12:28'),
(544, 1, 'payment_charge', 'Withdraw approval charge', 170, 8.5, 0, 'approved', '02-08-2025 15:13', '2025-08-02 15:13:05', '2025-08-02 15:13:05'),
(545, 1, 'payment_charge', 'Withdraw approval charge', 170, 8.5, 0, 'approved', '02-08-2025 15:56', '2025-08-02 15:56:50', '2025-08-02 15:56:50'),
(546, 1, 'payment_charge', 'Withdraw approval charge', 200, 10, 0, 'approved', '02-08-2025 15:57', '2025-08-02 15:57:42', '2025-08-02 15:57:42'),
(547, 1, 'payment_charge', 'Withdraw approval charge', 297, 14.85, 0, 'approved', '02-08-2025 15:58', '2025-08-02 15:58:32', '2025-08-02 15:58:32'),
(548, 1, 'payment_charge', 'Withdraw approval charge', 150, 7.5, 0, 'approved', '02-08-2025 16:25', '2025-08-02 16:25:29', '2025-08-02 16:25:29'),
(549, 1, 'payment_charge', 'Withdraw approval charge', 170, 8.5, 0, 'approved', '02-08-2025 16:53', '2025-08-02 16:53:17', '2025-08-02 16:53:17'),
(550, 1, 'payment_charge', 'Withdraw approval charge', 215, 10.75, 0, 'approved', '02-08-2025 16:54', '2025-08-02 16:54:02', '2025-08-02 16:54:02'),
(551, 1, 'payment_charge', 'Withdraw approval charge', 170, 8.5, 0, 'approved', '02-08-2025 17:21', '2025-08-02 17:21:51', '2025-08-02 17:21:51'),
(552, 1, 'payment_charge', 'Withdraw approval charge', 325, 16.25, 0, 'approved', '02-08-2025 17:23', '2025-08-02 17:23:59', '2025-08-02 17:23:59'),
(553, 1, 'payment_charge', 'Withdraw approval charge', 170, 8.5, 0, 'approved', '02-08-2025 17:47', '2025-08-02 17:47:29', '2025-08-02 17:47:29'),
(554, 1, 'payment_charge', 'Withdraw approval charge', 178, 8.9, 0, 'approved', '02-08-2025 18:10', '2025-08-02 18:10:24', '2025-08-02 18:10:24'),
(555, 1, 'payment_charge', 'Withdraw approval charge', 170, 8.5, 0, 'approved', '02-08-2025 18:16', '2025-08-02 18:16:46', '2025-08-02 18:16:46'),
(556, 1, 'payment_charge', 'Withdraw approval charge', 170, 8.5, 0, 'approved', '02-08-2025 18:32', '2025-08-02 18:32:25', '2025-08-02 18:32:25'),
(557, 1, 'payment_charge', 'Withdraw approval charge', 290, 14.5, 0, 'approved', '02-08-2025 19:00', '2025-08-02 19:00:31', '2025-08-02 19:00:31'),
(558, 1, 'payment_charge', 'Withdraw approval charge', 491, 24.55, 0, 'approved', '02-08-2025 19:20', '2025-08-02 19:20:40', '2025-08-02 19:20:40'),
(559, 1, 'payment_charge', 'Withdraw approval charge', 215, 10.75, 0, 'approved', '02-08-2025 19:42', '2025-08-02 19:42:43', '2025-08-02 19:42:43'),
(560, 1, 'payment_charge', 'Withdraw approval charge', 215, 10.75, 0, 'approved', '02-08-2025 19:55', '2025-08-02 19:55:58', '2025-08-02 19:55:58'),
(561, 1, 'payment_charge', 'Withdraw approval charge', 160, 8, 0, 'approved', '02-08-2025 19:56', '2025-08-02 19:56:59', '2025-08-02 19:56:59'),
(562, 1, 'payment_charge', 'Withdraw approval charge', 210, 10.5, 0, 'approved', '02-08-2025 19:57', '2025-08-02 19:57:38', '2025-08-02 19:57:38'),
(563, 1, 'payment_charge', 'Withdraw approval charge', 220, 11, 0, 'approved', '02-08-2025 20:14', '2025-08-02 20:14:04', '2025-08-02 20:14:04'),
(564, 1, 'payment_charge', 'Withdraw approval charge', 378, 18.9, 0, 'approved', '02-08-2025 20:38', '2025-08-02 20:38:23', '2025-08-02 20:38:23'),
(565, 1, 'payment_charge', 'Withdraw approval charge', 213, 10.65, 0, 'approved', '02-08-2025 20:51', '2025-08-02 20:51:14', '2025-08-02 20:51:14'),
(566, 1, 'payment_charge', 'Withdraw approval charge', 210, 10.5, 0, 'approved', '02-08-2025 21:14', '2025-08-02 21:14:35', '2025-08-02 21:14:35'),
(567, 1, 'payment_charge', 'Withdraw approval charge', 210, 10.5, 0, 'approved', '02-08-2025 21:16', '2025-08-02 21:16:25', '2025-08-02 21:16:25'),
(568, 1, 'payment_charge', 'Withdraw approval charge', 175, 8.75, 0, 'approved', '02-08-2025 21:18', '2025-08-02 21:18:33', '2025-08-02 21:18:33'),
(569, 1, 'payment_charge', 'Withdraw approval charge', 358, 17.9, 0, 'approved', '02-08-2025 22:24', '2025-08-02 22:24:39', '2025-08-02 22:24:39'),
(570, 1, 'payment_charge', 'Withdraw approval charge', 483, 24.15, 0, 'approved', '02-08-2025 22:26', '2025-08-02 22:26:22', '2025-08-02 22:26:22'),
(571, 1, 'payment_charge', 'Withdraw approval charge', 215, 10.75, 0, 'approved', '02-08-2025 22:40', '2025-08-02 22:40:16', '2025-08-02 22:40:16'),
(572, 1, 'payment_charge', 'Withdraw approval charge', 160, 8, 0, 'approved', '02-08-2025 22:43', '2025-08-02 22:43:37', '2025-08-02 22:43:37'),
(573, 1, 'payment_charge', 'Withdraw approval charge', 215, 10.75, 0, 'approved', '02-08-2025 22:54', '2025-08-02 22:54:50', '2025-08-02 22:54:50'),
(574, 1, 'payment_charge', 'Withdraw approval charge', 170, 8.5, 0, 'approved', '02-08-2025 22:55', '2025-08-02 22:55:43', '2025-08-02 22:55:43'),
(575, 1, 'payment_charge', 'Withdraw approval charge', 318, 15.9, 0, 'approved', '02-08-2025 22:56', '2025-08-02 22:56:57', '2025-08-02 22:56:57'),
(576, 1, 'payment_charge', 'Withdraw approval charge', 327, 16.35, 0, 'approved', '03-08-2025 10:03', '2025-08-03 10:03:54', '2025-08-03 10:03:54'),
(577, 1, 'payment_charge', 'Withdraw approval charge', 400, 20, 0, 'approved', '03-08-2025 10:15', '2025-08-03 10:15:04', '2025-08-03 10:15:04'),
(578, 1, 'payment_charge', 'Withdraw approval charge', 180, 9, 0, 'approved', '03-08-2025 10:17', '2025-08-03 10:17:45', '2025-08-03 10:17:45'),
(579, 1, 'payment_charge', 'Withdraw approval charge', 598, 29.9, 0, 'approved', '03-08-2025 10:39', '2025-08-03 10:39:14', '2025-08-03 10:39:14'),
(580, 1, 'payment_charge', 'Withdraw approval charge', 180, 9, 0, 'approved', '03-08-2025 11:12', '2025-08-03 11:12:39', '2025-08-03 11:12:39'),
(581, 1, 'payment_charge', 'Withdraw approval charge', 200, 10, 0, 'approved', '03-08-2025 11:40', '2025-08-03 11:40:58', '2025-08-03 11:40:58'),
(582, 1, 'payment_charge', 'Withdraw approval charge', 170, 8.5, 0, 'approved', '03-08-2025 11:55', '2025-08-03 11:55:47', '2025-08-03 11:55:47'),
(583, 1, 'payment_charge', 'Withdraw approval charge', 311, 15.55, 0, 'approved', '03-08-2025 11:56', '2025-08-03 11:56:27', '2025-08-03 11:56:27'),
(584, 1, 'payment_charge', 'Withdraw approval charge', 160, 8, 0, 'approved', '03-08-2025 12:11', '2025-08-03 12:11:17', '2025-08-03 12:11:17'),
(585, 1, 'payment_charge', 'Withdraw approval charge', 150, 7.5, 0, 'approved', '03-08-2025 12:50', '2025-08-03 12:50:30', '2025-08-03 12:50:30'),
(586, 1, 'payment_charge', 'Withdraw approval charge', 330, 16.5, 0, 'approved', '03-08-2025 13:21', '2025-08-03 13:21:23', '2025-08-03 13:21:23'),
(587, 1, 'payment_charge', 'Withdraw approval charge', 253, 12.65, 0, 'approved', '03-08-2025 13:48', '2025-08-03 13:48:07', '2025-08-03 13:48:07'),
(588, 1, 'payment_charge', 'Withdraw approval charge', 150, 7.5, 0, 'approved', '03-08-2025 14:02', '2025-08-03 14:02:52', '2025-08-03 14:02:52'),
(589, 1, 'payment_charge', 'Withdraw approval charge', 150, 7.5, 0, 'approved', '03-08-2025 14:03', '2025-08-03 14:03:40', '2025-08-03 14:03:40'),
(590, 1, 'payment_charge', 'Withdraw approval charge', 175, 8.75, 0, 'approved', '03-08-2025 14:06', '2025-08-03 14:06:41', '2025-08-03 14:06:41'),
(591, 1, 'payment_charge', 'Withdraw approval charge', 215, 10.75, 0, 'approved', '03-08-2025 14:22', '2025-08-03 14:22:43', '2025-08-03 14:22:43'),
(592, 1, 'payment_charge', 'Withdraw approval charge', 160, 8, 0, 'approved', '03-08-2025 14:23', '2025-08-03 14:23:53', '2025-08-03 14:23:53'),
(593, 1, 'payment_charge', 'Withdraw approval charge', 190, 9.5, 0, 'approved', '03-08-2025 14:39', '2025-08-03 14:39:22', '2025-08-03 14:39:22'),
(594, 1, 'payment_charge', 'Withdraw approval charge', 190, 9.5, 0, 'approved', '03-08-2025 14:59', '2025-08-03 14:59:32', '2025-08-03 14:59:32'),
(595, 1, 'payment_charge', 'Withdraw approval charge', 650, 32.5, 0, 'approved', '03-08-2025 15:24', '2025-08-03 15:24:05', '2025-08-03 15:24:05'),
(596, 1, 'payment_charge', 'Withdraw approval charge', 155, 7.75, 0, 'approved', '03-08-2025 15:25', '2025-08-03 15:25:10', '2025-08-03 15:25:10'),
(597, 1, 'payment_charge', 'Withdraw approval charge', 308, 15.4, 0, 'approved', '03-08-2025 15:35', '2025-08-03 15:35:52', '2025-08-03 15:35:52'),
(598, 1, 'payment_charge', 'Withdraw approval charge', 170, 8.5, 0, 'approved', '03-08-2025 15:36', '2025-08-03 15:36:28', '2025-08-03 15:36:28'),
(599, 1, 'payment_charge', 'Withdraw approval charge', 478, 23.9, 0, 'approved', '03-08-2025 15:37', '2025-08-03 15:37:08', '2025-08-03 15:37:08'),
(600, 1, 'payment_charge', 'Withdraw approval charge', 490, 24.5, 0, 'approved', '03-08-2025 16:07', '2025-08-03 16:07:23', '2025-08-03 16:07:23'),
(601, 1, 'payment_charge', 'Withdraw approval charge', 225, 11.25, 0, 'approved', '03-08-2025 16:08', '2025-08-03 16:08:43', '2025-08-03 16:08:43'),
(602, 1, 'payment_charge', 'Withdraw approval charge', 180, 9, 0, 'approved', '03-08-2025 16:21', '2025-08-03 16:21:44', '2025-08-03 16:21:44'),
(603, 1, 'payment_charge', 'Withdraw approval charge', 153, 7.65, 0, 'approved', '03-08-2025 16:31', '2025-08-03 16:31:08', '2025-08-03 16:31:08'),
(604, 1, 'payment_charge', 'Withdraw approval charge', 605, 30.25, 0, 'approved', '03-08-2025 16:32', '2025-08-03 16:32:08', '2025-08-03 16:32:08'),
(605, 1, 'payment_charge', 'Withdraw approval charge', 160, 8, 0, 'approved', '03-08-2025 16:42', '2025-08-03 16:42:38', '2025-08-03 16:42:38'),
(606, 1, 'payment_charge', 'Withdraw approval charge', 210, 10.5, 0, 'approved', '03-08-2025 16:53', '2025-08-03 16:53:55', '2025-08-03 16:53:55'),
(607, 1, 'payment_charge', 'Withdraw approval charge', 300, 15, 0, 'approved', '03-08-2025 17:37', '2025-08-03 17:37:48', '2025-08-03 17:37:48'),
(608, 1, 'payment_charge', 'Withdraw approval charge', 215, 10.75, 0, 'approved', '03-08-2025 17:38', '2025-08-03 17:38:47', '2025-08-03 17:38:47'),
(609, 1, 'payment_charge', 'Withdraw approval charge', 320, 16, 0, 'approved', '03-08-2025 19:15', '2025-08-03 19:15:02', '2025-08-03 19:15:02'),
(610, 1, 'payment_charge', 'Withdraw approval charge', 215, 10.75, 0, 'approved', '03-08-2025 19:33', '2025-08-03 19:33:26', '2025-08-03 19:33:26'),
(611, 1, 'payment_charge', 'Withdraw approval charge', 170, 8.5, 0, 'approved', '03-08-2025 19:34', '2025-08-03 19:34:17', '2025-08-03 19:34:17'),
(612, 1, 'payment_charge', 'Withdraw approval charge', 160, 8, 0, 'approved', '03-08-2025 20:42', '2025-08-03 20:42:09', '2025-08-03 20:42:09'),
(613, 1, 'payment_charge', 'Withdraw approval charge', 150, 7.5, 0, 'approved', '03-08-2025 20:49', '2025-08-03 20:49:15', '2025-08-03 20:49:15'),
(614, 1, 'payment_charge', 'Withdraw approval charge', 150, 7.5, 0, 'approved', '03-08-2025 20:59', '2025-08-03 20:59:47', '2025-08-03 20:59:47'),
(615, 1, 'payment_charge', 'Withdraw approval charge', 170, 8.5, 0, 'approved', '03-08-2025 21:00', '2025-08-03 21:00:37', '2025-08-03 21:00:37'),
(616, 1, 'payment_charge', 'Withdraw approval charge', 180, 9, 0, 'approved', '03-08-2025 21:01', '2025-08-03 21:01:10', '2025-08-03 21:01:10'),
(617, 1, 'payment_charge', 'Withdraw approval charge', 346, 17.3, 0, 'approved', '03-08-2025 22:04', '2025-08-03 22:04:26', '2025-08-03 22:04:26'),
(618, 1, 'payment_charge', 'Withdraw approval charge', 150, 7.5, 0, 'approved', '03-08-2025 22:21', '2025-08-03 22:21:49', '2025-08-03 22:21:49'),
(619, 1, 'payment_charge', 'Withdraw approval charge', 165, 8.25, 0, 'approved', '03-08-2025 22:23', '2025-08-03 22:23:02', '2025-08-03 22:23:02'),
(620, 1, 'payment_charge', 'Withdraw approval charge', 315, 15.75, 0, 'approved', '03-08-2025 22:23', '2025-08-03 22:23:48', '2025-08-03 22:23:48'),
(621, 1, 'payment_charge', 'Withdraw approval charge', 385, 19.25, 0, 'approved', '03-08-2025 22:24', '2025-08-03 22:24:36', '2025-08-03 22:24:36'),
(622, 1, 'payment_charge', 'Withdraw approval charge', 220, 11, 0, 'approved', '03-08-2025 22:27', '2025-08-03 22:27:48', '2025-08-03 22:27:48'),
(623, 1, 'payment_charge', 'Withdraw approval charge', 175, 8.75, 0, 'approved', '03-08-2025 22:39', '2025-08-03 22:39:29', '2025-08-03 22:39:29'),
(624, 1, 'payment_charge', 'Withdraw approval charge', 323, 16.15, 0, 'approved', '03-08-2025 22:55', '2025-08-03 22:55:54', '2025-08-03 22:55:54'),
(625, 1, 'payment_charge', 'Withdraw approval charge', 184, 9.2, 0, 'approved', '03-08-2025 23:00', '2025-08-03 23:00:26', '2025-08-03 23:00:26'),
(626, 1, 'payment_charge', 'Withdraw approval charge', 222, 11.1, 0, 'approved', '03-08-2025 23:01', '2025-08-03 23:01:09', '2025-08-03 23:01:09'),
(627, 1, 'payment_charge', 'Withdraw approval charge', 170, 8.5, 0, 'approved', '04-08-2025 10:01', '2025-08-04 10:01:36', '2025-08-04 10:01:36'),
(628, 1, 'payment_charge', 'Withdraw approval charge', 548, 27.4, 0, 'approved', '04-08-2025 10:03', '2025-08-04 10:03:12', '2025-08-04 10:03:12'),
(629, 1, 'payment_charge', 'Withdraw approval charge', 215, 10.75, 0, 'approved', '04-08-2025 10:04', '2025-08-04 10:04:16', '2025-08-04 10:04:16'),
(630, 1, 'payment_charge', 'Withdraw approval charge', 195, 9.75, 0, 'approved', '04-08-2025 10:48', '2025-08-04 10:48:02', '2025-08-04 10:48:02'),
(631, 1, 'payment_charge', 'Withdraw approval charge', 220, 11, 0, 'approved', '04-08-2025 10:49', '2025-08-04 10:49:07', '2025-08-04 10:49:07'),
(632, 1, 'payment_charge', 'Withdraw approval charge', 250, 12.5, 0, 'approved', '04-08-2025 10:50', '2025-08-04 10:50:28', '2025-08-04 10:50:28'),
(633, 1, 'payment_charge', 'Withdraw approval charge', 560, 28, 0, 'approved', '04-08-2025 10:51', '2025-08-04 10:51:05', '2025-08-04 10:51:05'),
(634, 1, 'payment_charge', 'Withdraw approval charge', 250, 12.5, 0, 'approved', '04-08-2025 10:52', '2025-08-04 10:52:24', '2025-08-04 10:52:24'),
(635, 1, 'payment_charge', 'Withdraw approval charge', 355, 17.75, 0, 'approved', '04-08-2025 10:52', '2025-08-04 10:52:58', '2025-08-04 10:52:58'),
(636, 1, 'payment_charge', 'Withdraw approval charge', 448, 22.4, 0, 'approved', '04-08-2025 10:54', '2025-08-04 10:54:18', '2025-08-04 10:54:18'),
(637, 1, 'payment_charge', 'Withdraw approval charge', 1898, 94.9, 0, 'approved', '04-08-2025 10:54', '2025-08-04 10:54:47', '2025-08-04 10:54:47'),
(638, 1, 'payment_charge', 'Withdraw approval charge', 150, 7.5, 0, 'approved', '04-08-2025 11:03', '2025-08-04 11:03:15', '2025-08-04 11:03:15'),
(639, 1, 'payment_charge', 'Withdraw approval charge', 597, 29.85, 0, 'approved', '04-08-2025 11:51', '2025-08-04 11:51:04', '2025-08-04 11:51:04'),
(640, 1, 'payment_charge', 'Withdraw approval charge', 170, 8.5, 0, 'approved', '04-08-2025 11:59', '2025-08-04 11:59:43', '2025-08-04 11:59:43'),
(641, 1, 'payment_charge', 'Withdraw approval charge', 200, 10, 0, 'approved', '04-08-2025 12:09', '2025-08-04 12:09:26', '2025-08-04 12:09:26'),
(642, 1, 'payment_charge', 'Withdraw approval charge', 282, 14.1, 0, 'approved', '04-08-2025 12:11', '2025-08-04 12:11:42', '2025-08-04 12:11:42'),
(643, 1, 'payment_charge', 'Withdraw approval charge', 282, 14.1, 0, 'approved', '04-08-2025 12:11', '2025-08-04 12:11:43', '2025-08-04 12:11:43'),
(644, 1, 'payment_charge', 'Withdraw approval charge', 160, 8, 0, 'approved', '04-08-2025 12:23', '2025-08-04 12:23:48', '2025-08-04 12:23:48'),
(645, 1, 'payment_charge', 'Withdraw approval charge', 390, 19.5, 0, 'approved', '04-08-2025 12:40', '2025-08-04 12:40:40', '2025-08-04 12:40:40'),
(646, 1, 'payment_charge', 'Withdraw approval charge', 165, 8.25, 0, 'approved', '04-08-2025 12:47', '2025-08-04 12:47:55', '2025-08-04 12:47:55'),
(647, 1, 'payment_charge', 'Withdraw approval charge', 199, 9.95, 0, 'approved', '04-08-2025 12:48', '2025-08-04 12:48:49', '2025-08-04 12:48:49'),
(648, 1, 'payment_charge', 'Withdraw approval charge', 150, 7.5, 0, 'approved', '04-08-2025 13:10', '2025-08-04 13:10:42', '2025-08-04 13:10:42'),
(649, 1, 'payment_charge', 'Withdraw approval charge', 250, 12.5, 0, 'approved', '04-08-2025 13:23', '2025-08-04 13:23:42', '2025-08-04 13:23:42'),
